PMID,Title,Authors,Citation,First Author,Journal/Book,Publication Year,Create Date,PMCID,NIHMS ID,DOI
"28078397","Optimized synthesis of novel prenyl ferulate performed by feruloyl esterases from Myceliophthora thermophila in microemulsions","Antonopoulou I, Leonov L, Jütten P, Cerullo G, Faraco V, Papadopoulou A, Kletsas D, Ralli M, Rova U, Christakopoulos P.","Appl Microbiol Biotechnol. 2017 Apr;101(8):3213-3226. doi: 10.1007/s00253-017-8089-8. Epub 2017 Jan 11.","Antonopoulou I","Appl Microbiol Biotechnol","2017","2017/01/13","PMC5380708","","10.1007/s00253-017-8089-8"
"22728192","Two GH10 endo-xylanases from Myceliophthora thermophila C1 with and without cellulose binding module act differently towards soluble and insoluble xylans","van Gool MP, van Muiswinkel GC, Hinz SW, Schols HA, Sinitsyn AP, Gruppen H.","Bioresour Technol. 2012 Sep;119:123-32. doi: 10.1016/j.biortech.2012.05.117. Epub 2012 May 29.","van Gool MP","Bioresour Technol","2012","2012/06/26","","","10.1016/j.biortech.2012.05.117"
"26279477","Determination of Specificity and Biochemical Characteristics of Neutral Protease Isolated from Myceliophthora thermophila","Neto YA, de Oliveira LC, de Oliveira AH, Rosa JC, Juliano MA, Juliano L, Rodrigues A, Cabral H.","Protein Pept Lett. 2015;22(11):972-82. doi: 10.2174/0929866522666150817093719.","Neto YA","Protein Pept Lett","2015","2015/08/18","","","10.2174/0929866522666150817093719"
"23638383","Cloning, expression and characterization of an ethanol tolerant GH3 β-glucosidase from Myceliophthora thermophila","Karnaouri A, Topakas E, Paschos T, Taouki I, Christakopoulos P.","PeerJ. 2013 Feb 26;1:e46. doi: 10.7717/peerj.46. Print 2013.","Karnaouri A","PeerJ","2013","2013/05/03","PMC3628895","","10.7717/peerj.46"
"22342900","Degradation of estrogens by laccase from Myceliophthora thermophila in fed-batch and enzymatic membrane reactors","Lloret L, Eibes G, Feijoo G, Moreira MT, Lema JM.","J Hazard Mater. 2012 Apr 30;213-214:175-83. doi: 10.1016/j.jhazmat.2012.01.082. Epub 2012 Feb 1.","Lloret L","J Hazard Mater","2012","2012/02/21","","","10.1016/j.jhazmat.2012.01.082"
"30555766","Decolorization and detoxification of textile wastewaters by recombinant Myceliophthora thermophila and Trametes trogii laccases","Herkommerová K, Dostál J, Pichová I.","3 Biotech. 2018 Dec;8(12):505. doi: 10.1007/s13205-018-1525-3. Epub 2018 Nov 30.","Herkommerová K","3 Biotech","2018","2018/12/18","PMC6269326","","10.1007/s13205-018-1525-3"
"28688965","Kinetic and amperometric study of the MtPerII peroxidase isolated from the ascomycete fungus Myceliophthora thermophila","Zouraris D, Zerva A, Topakas E, Karantonis A.","Bioelectrochemistry. 2017 Dec;118:19-24. doi: 10.1016/j.bioelechem.2017.06.011. Epub 2017 Jun 30.","Zouraris D","Bioelectrochemistry","2017","2017/07/10","","","10.1016/j.bioelechem.2017.06.011"
"30023729","Expression, Purification, and Biochemical Characterization of the Flavocytochrome P450 CYP505A30 from Myceliophthora thermophila","Baker GJ, Girvan HM, Matthews S, McLean KJ, Golovanova M, Waltham TN, Rigby SEJ, Nelson DR, Blankley RT, Munro AW.","ACS Omega. 2017 Aug 31;2(8):4705-4724. doi: 10.1021/acsomega.7b00450. Epub 2017 Aug 18.","Baker GJ","ACS Omega","2017","2018/07/20","PMC6044835","","10.1021/acsomega.7b00450"
"36686237","Breeding of a thermostable xylanase-producing strain of Myceliophthora thermophila by atmospheric room temperature plasma (ARTP) mutagenesis","Zhang N, Jiang Y, Sun YJ, Jiang JC, Tong YJ.","Front Bioeng Biotechnol. 2023 Jan 5;10:1095323. doi: 10.3389/fbioe.2022.1095323. eCollection 2022.","Zhang N","Front Bioeng Biotechnol","2023","2023/01/23","PMC9849395","","10.3389/fbioe.2022.1095323"
"26773948","Saccharification of ozonated sugarcane bagasse using enzymes from Myceliophthora thermophila JCP 1-4 for sugars release and ethanol production","de Cassia Pereira J, Travaini R, Paganini Marques N, Bolado-Rodríguez S, Bocchini Martins DA.","Bioresour Technol. 2016 Mar;204:122-129. doi: 10.1016/j.biortech.2015.12.064. Epub 2015 Dec 23.","de Cassia Pereira J","Bioresour Technol","2016","2016/01/17","","","10.1016/j.biortech.2015.12.064"
"28501686","Immobilisation on mesoporous silica and solvent rinsing improve the transesterification abilities of feruloyl esterases from Myceliophthora thermophila","Hüttner S, Zezzi Do Valle Gomes M, Iancu L, Palmqvist A, Olsson L.","Bioresour Technol. 2017 Sep;239:57-65. doi: 10.1016/j.biortech.2017.04.106. Epub 2017 Apr 29.","Hüttner S","Bioresour Technol","2017","2017/05/15","","","10.1016/j.biortech.2017.04.106"
"26047916","Characterization and application of a novel class II thermophilic peroxidase from Myceliophthora thermophila in biosynthesis of polycatechol","Zerva A, Christakopoulos P, Topakas E.","Enzyme Microb Technol. 2015 Jul-Aug;75-76:49-56. doi: 10.1016/j.enzmictec.2015.04.012. Epub 2015 May 7.","Zerva A","Enzyme Microb Technol","2015","2015/06/07","","","10.1016/j.enzmictec.2015.04.012"
"21241422","Optimal culture conditions for keratinase production by a novel thermophilic Myceliophthora thermophila strain GZUIFR-H49-1","Liang JD, Han YF, Zhang JW, Du W, Liang ZQ, Li ZZ.","J Appl Microbiol. 2011 Apr;110(4):871-80. doi: 10.1111/j.1365-2672.2011.04949.x.","Liang JD","J Appl Microbiol","2011","2011/01/19","","","10.1111/j.1365-2672.2011.04949.x"
"12202045","Toxicological studies on Laccase from Myceliophthora thermophila expressed in Aspergillus oryzae","Brinch DS, Pedersen PB.","Regul Toxicol Pharmacol. 2002 Jun;35(3):296-307. doi: 10.1006/rtph.2002.1538.","Brinch DS","Regul Toxicol Pharmacol","2002","2002/08/31","","","10.1006/rtph.2002.1538"
"16848420","Thermostability of native and pegylated Myceliophthora thermophila laccase in aqueous and mixed solvents","López-Cruz JI, Viniegra-Gonzalez G, Hernández-Arana A.","Bioconjug Chem. 2006 Jul-Aug;17(4):1093-8. doi: 10.1021/bc0503465.","López-Cruz JI","Bioconjug Chem","2006","2006/07/20","","","10.1021/bc0503465"
"36966330","The arabinose transporter MtLat-1 is involved in hemicellulase repression as a pentose transceptor in Myceliophthora thermophila","Gu S, Zhao Z, Xue F, Liu D, Liu Q, Li J, Tian C.","Biotechnol Biofuels Bioprod. 2023 Mar 25;16(1):51. doi: 10.1186/s13068-023-02305-3.","Gu S","Biotechnol Biofuels Bioprod","2023","2023/03/25","PMC10040116","","10.1186/s13068-023-02305-3"
"28515785","Recombinant expression of thermostable processive MtEG5 endoglucanase and its synergism with MtLPMO from Myceliophthora thermophila during the hydrolysis of lignocellulosic substrates","Karnaouri A, Muraleedharan MN, Dimarogona M, Topakas E, Rova U, Sandgren M, Christakopoulos P.","Biotechnol Biofuels. 2017 May 15;10:126. doi: 10.1186/s13068-017-0813-1. eCollection 2017.","Karnaouri A","Biotechnol Biofuels","2017","2017/05/19","PMC5432998","","10.1186/s13068-017-0813-1"
"26234435","Heterologous Expression and Characterization of a GH3 β-Glucosidase from Thermophilic Fungi Myceliophthora thermophila in Pichia pastoris","Zhao J, Guo C, Tian C, Ma Y.","Appl Biochem Biotechnol. 2015 Sep;177(2):511-27. doi: 10.1007/s12010-015-1759-z. Epub 2015 Aug 4.","Zhao J","Appl Biochem Biotechnol","2015","2015/08/04","","","10.1007/s12010-015-1759-z"
"25869365","Properties of enzyme preparations and homogeneous enzymes - endoglucanases EG2 Penicillium verruculosum and LAM Myceliophthora thermophila","Merzlov DA, Zorov IN, Dotsenko GS, Denisenko YA, Rozhkova AM, Satrutdinov AD, Rubtsova EA, Kondratieva EG, Sinitsyn AP.","Biochemistry (Mosc). 2015 Apr;80(4):473-82. doi: 10.1134/S0006297915040112.","Merzlov DA","Biochemistry (Mosc)","2015","2015/04/15","","","10.1134/S0006297915040112"
"21511459","Towards industrially-feasible delignification and pitch removal by treating paper pulp with Myceliophthora thermophila laccase and a phenolic mediator","Babot ED, Rico A, Rencoret J, Kalum L, Lund H, Romero J, del Río JC, Martínez AT, Gutiérrez A.","Bioresour Technol. 2011 Jun;102(12):6717-22. doi: 10.1016/j.biortech.2011.03.100. Epub 2011 Apr 2.","Babot ED","Bioresour Technol","2011","2011/04/23","","","10.1016/j.biortech.2011.03.100"
"23615741","Cloning, expression, and characterization of a thermostable GH7 endoglucanase from Myceliophthora thermophila capable of high-consistency enzymatic liquefaction","Karnaouri AC, Topakas E, Christakopoulos P.","Appl Microbiol Biotechnol. 2014 Jan;98(1):231-42. doi: 10.1007/s00253-013-4895-9. Epub 2013 Apr 25.","Karnaouri AC","Appl Microbiol Biotechnol","2014","2013/04/26","","","10.1007/s00253-013-4895-9"
"19075602","Combinatorial saturation mutagenesis of the Myceliophthora thermophila laccase T2 mutant: the connection between the C-terminal plug and the conserved (509)VSG(511) tripeptide","Zumárraga M, Vaz Domínguez C, Camarero S, Shleev S, Polaina J, Martínez-Arias A, Ferrer M, De Lacey AL, Fernández VM, Ballesteros A, Plou FJ, Alcalde M.","Comb Chem High Throughput Screen. 2008 Dec;11(10):807-16. doi: 10.2174/138620708786734235.","Zumárraga M","Comb Chem High Throughput Screen","2008","2008/12/17","","","10.2174/138620708786734235"
"21964414","Comparative genomic analysis of the thermophilic biomass-degrading fungi Myceliophthora thermophila and Thielavia terrestris","Berka RM, Grigoriev IV, Otillar R, Salamov A, Grimwood J, Reid I, Ishmael N, John T, Darmond C, Moisan MC, Henrissat B, Coutinho PM, Lombard V, Natvig DO, Lindquist E, Schmutz J, Lucas S, Harris P, Powlowski J, Bellemare A, Taylor D, Butler G, de Vries RP, Allijn IE, van den Brink J, Ushinsky S, Storms R, Powell AJ, Paulsen IT, Elbourne LD, Baker SE, Magnuson J, Laboissiere S, Clutterbuck AJ, Martinez D, Wogulis M, de Leon AL, Rey MW, Tsang A.","Nat Biotechnol. 2011 Oct 2;29(10):922-7. doi: 10.1038/nbt.1976.","Berka RM","Nat Biotechnol","2011","2011/10/04","","","10.1038/nbt.1976"
"23275164","The structure of a novel glucuronoyl esterase from Myceliophthora thermophila gives new insights into its role as a potential biocatalyst","Charavgi MD, Dimarogona M, Topakas E, Christakopoulos P, Chrysina ED.","Acta Crystallogr D Biol Crystallogr. 2013 Jan;69(Pt 1):63-73. doi: 10.1107/S0907444912042400. Epub 2012 Dec 20.","Charavgi MD","Acta Crystallogr D Biol Crystallogr","2013","2013/01/01","","","10.1107/S0907444912042400"
"22012339","Expression, characterization and structural modelling of a feruloyl esterase from the thermophilic fungus Myceliophthora thermophila","Topakas E, Moukouli M, Dimarogona M, Christakopoulos P.","Appl Microbiol Biotechnol. 2012 Apr;94(2):399-411. doi: 10.1007/s00253-011-3612-9. Epub 2011 Oct 20.","Topakas E","Appl Microbiol Biotechnol","2012","2011/10/21","","","10.1007/s00253-011-3612-9"
"21429692","A fatal case with disseminated Myceliophthora thermophila infection in a lymphoma patient","Le Naourès C, Bonhomme J, Terzi N, Duhamel C, Galateau-Sallé F.","Diagn Microbiol Infect Dis. 2011 Jun;70(2):267-9. doi: 10.1016/j.diagmicrobio.2011.01.003. Epub 2011 Mar 22.","Le Naourès C","Diagn Microbiol Infect Dis","2011","2011/03/25","","","10.1016/j.diagmicrobio.2011.01.003"
"19482085","An unusual ring--a opening and other reactions in steroid transformation by the thermophilic fungus Myceliophthora thermophila","Hunter AC, Watts KR, Dedi C, Dodd HT.","J Steroid Biochem Mol Biol. 2009 Sep;116(3-5):171-7. doi: 10.1016/j.jsbmb.2009.05.012. Epub 2009 May 29.","Hunter AC","J Steroid Biochem Mol Biol","2009","2009/06/02","","","10.1016/j.jsbmb.2009.05.012"
"23360704","Polymerisation of Kraft lignin from black liquors by laccase from Myceliophthora thermophila: effect of operational conditions and black liquor origin","Gouveia S, Fernández-Costas C, Sanromán MA, Moldes D.","Bioresour Technol. 2013 Mar;131:288-94. doi: 10.1016/j.biortech.2012.12.155. Epub 2013 Jan 3.","Gouveia S","Bioresour Technol","2013","2013/01/31","","","10.1016/j.biortech.2012.12.155"
"24692305","Stability and kinetic behavior of immobilized laccase from Myceliophthora thermophila in the presence of the ionic liquid 1-ethyl-3-methylimidazolium ethylsulfate","Fernández-Fernández M, Moldes D, Domínguez A, Sanromán MÁ, Tavares AP, Rodríguez O, Macedo EA.","Biotechnol Prog. 2014 Jul-Aug;30(4):790-6. doi: 10.1002/btpr.1910. Epub 2014 Apr 16.","Fernández-Fernández M","Biotechnol Prog","2014","2014/04/03","","","10.1002/btpr.1910"
"24531271","Enzymatic synthesis of model substrates recognized by glucuronoyl esterases from Podospora anserina and Myceliophthora thermophila","Katsimpouras C, Bénarouche A, Navarro D, Karpusas M, Dimarogona M, Berrin JG, Christakopoulos P, Topakas E.","Appl Microbiol Biotechnol. 2014 Jun;98(12):5507-16. doi: 10.1007/s00253-014-5542-9. Epub 2014 Feb 16.","Katsimpouras C","Appl Microbiol Biotechnol","2014","2014/02/18","","","10.1007/s00253-014-5542-9"
"2269871","Purification and properties of an extracellular endoglucanase from Myceliophthora thermophila D-14 (ATCC 48104)","Roy SK, Dey SK, Raha SK, Chakrabarty SL.","J Gen Microbiol. 1990 Oct;136(10):1967-71. doi: 10.1099/00221287-136-10-1967.","Roy SK","J Gen Microbiol","1990","1990/10/01","","","10.1099/00221287-136-10-1967"
"35205873","Engineered Fungus Thermothelomyces thermophilus Producing Plant Storage Proteins","Balabanova L, Seitkalieva A, Yugay Y, Rusapetova T, Slepchenko L, Podvolotskaya A, Yatsunskaya M, Vasyutkina E, Son O, Tekutyeva L, Shkryl Y.","J Fungi (Basel). 2022 Jan 26;8(2):119. doi: 10.3390/jof8020119.","Balabanova L","J Fungi (Basel)","2022","2022/02/25","PMC8877005","","10.3390/jof8020119"
"27286691","Efficacy and safety of itraconazole use in infants","Chen S, Sun KY, Feng XW, Ran X, Lama J, Ran YP.","World J Pediatr. 2016 Nov;12(4):399-407. doi: 10.1007/s12519-016-0034-x. Epub 2016 Jun 10.","Chen S","World J Pediatr","2016","2016/06/12","","","10.1007/s12519-016-0034-x"
"16347725","Induction and Catabolite Repression of beta-Glucosidase Synthesis in Myceliophthora thermophila D-14 (= ATCC 48104)","Roy SK, Raha SK, Dey SK, Chakrabarty SL.","Appl Environ Microbiol. 1988 Aug;54(8):2152-3. doi: 10.1128/aem.54.8.2152-2153.1988.","Roy SK","Appl Environ Microbiol","1988","1988/08/01","PMC202822","","10.1128/aem.54.8.2152-2153.1988"
"24425278","Purification and characterization of extracellular β-glucosidase from Myceliophthora thermophila","Roy SK, Raha SK, Sadhukhan RK, Chakrabarty SL.","World J Microbiol Biotechnol. 1991 Nov;7(6):613-8. doi: 10.1007/BF00452843.","Roy SK","World J Microbiol Biotechnol","1991","2014/01/16","","","10.1007/BF00452843"
"6685815","[Thermophilic Myceliophthora thermophila decomposes cellulose]","Loginova LG, Beliakova LA, Guzhova EP, Iusupova IKh, Burdenko LG.","Mikrobiologiia. 1983 Jul-Aug;52(4):605-8.","Loginova LG","Mikrobiologiia","1983","1983/07/01","","",""
"32624738","Ultrasound-assisted swelling of bacterial cellulose","Song JE, Su J, Loureiro A, Martins M, Cavaco-Paulo A, Kim HR, Silva C.","Eng Life Sci. 2017 Aug 3;17(10):1108-1117. doi: 10.1002/elsc.201700085. eCollection 2017 Oct.","Song JE","Eng Life Sci","2017","2020/07/07","PMC6999602","","10.1002/elsc.201700085"
"17503417","Cytotoxic polyketides containing tetramic acid moieties isolated from the fungus Myceliophthora Thermophila: elucidation of the relationship between cytotoxicity and stereoconfiguration","Yang YL, Lu CP, Chen MY, Chen KY, Wu YC, Wu SH.","Chemistry. 2007;13(24):6985-91. doi: 10.1002/chem.200700038.","Yang YL","Chemistry","2007","2007/05/16","","","10.1002/chem.200700038"
"16961922","Severe osteomyelitis caused by Myceliophthora thermophila after a pitchfork injury","Destino L, Sutton DA, Helon AL, Havens PL, Thometz JG, Willoughby RE Jr, Chusid MJ.","Ann Clin Microbiol Antimicrob. 2006 Sep 8;5:21. doi: 10.1186/1476-0711-5-21.","Destino L","Ann Clin Microbiol Antimicrob","2006","2006/09/12","PMC1592504","","10.1186/1476-0711-5-21"
"9251203","Characterization of the gene encoding an extracellular laccase of Myceliophthora thermophila and analysis of the recombinant enzyme expressed in Aspergillus oryzae","Berka RM, Schneider P, Golightly EJ, Brown SH, Madden M, Brown KM, Halkier T, Mondorf K, Xu F.","Appl Environ Microbiol. 1997 Aug;63(8):3151-7. doi: 10.1128/aem.63.8.3151-3157.1997.","Berka RM","Appl Environ Microbiol","1997","1997/08/01","PMC168614","","10.1128/aem.63.8.3151-3157.1997"
"31235519","Substrate selectivity in starch polysaccharide monooxygenases","Vu VV, Hangasky JA, Detomasi TC, Henry SJW, Ngo ST, Span EA, Marletta MA.","J Biol Chem. 2019 Aug 9;294(32):12157-12166. doi: 10.1074/jbc.RA119.009509. Epub 2019 Jun 24.","Vu VV","J Biol Chem","2019","2019/06/26","PMC6690692","","10.1074/jbc.RA119.009509"
"9025298","The phytase subfamily of histidine acid phosphatases: isolation of genes for two novel phytases from the fungi Aspergillus terreus and Myceliophthora thermophila","Mitchell DB, Vogel K, Weimann BJ, Pasamontes L, van Loon APGM.","Microbiology (Reading). 1997 Jan;143 ( Pt 1):245-252. doi: 10.1099/00221287-143-1-245.","Mitchell DB","Microbiology (Reading)","1997","1997/01/01","","","10.1099/00221287-143-1-245"
"29159584","Correction to: Optimized synthesis of novel prenyl ferulate performed by feruloyl esterases from Myceliophthora thermophila in microemulsions","Antonopoulou I, Leonov L, Jütten P, Cerullo G, Faraco V, Papadopoulou A, Kletsas D, Ralli M, Rova U, Christakopoulos P.","Appl Microbiol Biotechnol. 2018 Jan;102(1):511. doi: 10.1007/s00253-017-8631-8.","Antonopoulou I","Appl Microbiol Biotechnol","2018","2017/11/22","PMC6828029","","10.1007/s00253-017-8631-8"
"20441569","Derivatization of the azole 1-aminobenzotriazole using laccase of Pycnoporus cinnabarinus and Myceliophthora thermophila: influence of methanol on the reaction and biological evaluation of the derivatives","Hahn V, Mikolasch A, Wende K, Bartrow H, Lindequist U, Schauer F.","Biotechnol Appl Biochem. 2010 May 27;56(2):43-8. doi: 10.1042/BA20100078.","Hahn V","Biotechnol Appl Biochem","2010","2010/05/06","","","10.1042/BA20100078"
"28053662","Development of a genome-editing CRISPR/Cas9 system in thermophilic fungal Myceliophthora species and its application to hyper-cellulase production strain engineering","Liu Q, Gao R, Li J, Lin L, Zhao J, Sun W, Tian C.","Biotechnol Biofuels. 2017 Jan 3;10:1. doi: 10.1186/s13068-016-0693-9. eCollection 2017.","Liu Q","Biotechnol Biofuels","2017","2017/01/06","PMC5209885","","10.1186/s13068-016-0693-9"
"36567332","Diarylation of thiazolopyrimidines by laccase and their in vitro evaluation as antitumor agents","Shahedi M, Shahani R, Habibi Z, Yousefi M, Brask J, Minaei-Tehrani A, Samadi FY, Mohammadi M.","Sci Rep. 2022 Dec 25;12(1):22326. doi: 10.1038/s41598-022-26820-9.","Shahedi M","Sci Rep","2022","2022/12/25","PMC9790884","","10.1038/s41598-022-26820-9"
"36162644","A fatal case of pneumonia caused by Thermothelomycesthermophila","Yoo IY, Kim K, Lee JW, Kang HM, Im SA, Park YJ.","J Infect Chemother. 2023 Jan;29(1):87-89. doi: 10.1016/j.jiac.2022.09.015. Epub 2022 Sep 24.","Yoo IY","J Infect Chemother","2023","2022/09/26","","","10.1016/j.jiac.2022.09.015"
"28777990","Additives enhancing enzymatic hydrolysis of lignocellulosic biomass","Rocha-Martín J, Martinez-Bernal C, Pérez-Cobas Y, Reyes-Sosa FM, García BD.","Bioresour Technol. 2017 Nov;244(Pt 1):48-56. doi: 10.1016/j.biortech.2017.06.132. Epub 2017 Jun 26.","Rocha-Martín J","Bioresour Technol","2017","2017/08/05","","","10.1016/j.biortech.2017.06.132"
"34336809","Enzyme Catalyzed Copolymerization of Lignosulfonates for Hydrophobic Coatings","Mayr SA, Schwaiger N, Weber HK, Kovač J, Guebitz GM, Nyanhongo GS.","Front Bioeng Biotechnol. 2021 Jul 14;9:697310. doi: 10.3389/fbioe.2021.697310. eCollection 2021.","Mayr SA","Front Bioeng Biotechnol","2021","2021/08/02","PMC8317694","","10.3389/fbioe.2021.697310"
"1452676","Fatal disseminated infection caused by Myceliophthora thermophila, a new agent of mycosis: case history and laboratory characteristics","Bourbeau P, McGough DA, Fraser H, Shah N, Rinaldi MG.","J Clin Microbiol. 1992 Nov;30(11):3019-23. doi: 10.1128/jcm.30.11.3019-3023.1992.","Bourbeau P","J Clin Microbiol","1992","1992/11/01","PMC270575","","10.1128/jcm.30.11.3019-3023.1992"
"19071650","Antioxidants determination with laccase","Kulys J, Bratkovskaja I.","Talanta. 2007 Apr 30;72(2):526-31. doi: 10.1016/j.talanta.2006.11.011. Epub 2006 Dec 8.","Kulys J","Talanta","2007","2008/12/17","","","10.1016/j.talanta.2006.11.011"
"30961066","Polymers from Bamboo Extracts Produced by Laccase","Su J, Wang C, Noro J, Cavaco-Paulo A, Silva C, Fu J.","Polymers (Basel). 2018 Oct 12;10(10):1141. doi: 10.3390/polym10101141.","Su J","Polymers (Basel)","2018","2019/04/10","PMC6404019","","10.3390/polym10101141"
"36916669","Biocatalytic stereoselective synthesis of pyrrolidine-2,3-diones containing all-carbon quaternary stereocenters","Shahedi M, Omidi N, Habibi Z, Yousefi M, Brask J, Notash B, Mohammadi M.","Org Biomol Chem. 2023 Mar 29;21(13):2742-2747. doi: 10.1039/d2ob02294j.","Shahedi M","Org Biomol Chem","2023","2023/03/14","","","10.1039/d2ob02294j"
"26722808","Increasing the lignin yield of the Alkaline Polyol Pulping process by treating black liquor with laccases of Myceliophthora thermophila","Engel N, Hundt M, Schapals T.","Bioresour Technol. 2016 Mar;203:96-102. doi: 10.1016/j.biortech.2015.12.027. Epub 2015 Dec 18.","Engel N","Bioresour Technol","2016","2016/01/02","","","10.1016/j.biortech.2015.12.027"
"35127677","Designing and Constructing a Novel Artificial Pathway for Malonic Acid Production Biologically","Gu S, Zhao Z, Yao Y, Li J, Tian C.","Front Bioeng Biotechnol. 2022 Jan 19;9:820507. doi: 10.3389/fbioe.2021.820507. eCollection 2021.","Gu S","Front Bioeng Biotechnol","2022","2022/02/07","PMC8807515","","10.3389/fbioe.2021.820507"
"36542100","Dissecting key residues of a C4-dicarboxylic acid transporter to accelerate malate export in Myceliophthora","Wu T, Wang Y, Li J, Tian C.","Appl Microbiol Biotechnol. 2023 Feb;107(2-3):609-622. doi: 10.1007/s00253-022-12336-9. Epub 2022 Dec 21.","Wu T","Appl Microbiol Biotechnol","2023","2022/12/21","","","10.1007/s00253-022-12336-9"
"32620929","Structural insight into mitochondrial β-barrel outer membrane protein biogenesis","Diederichs KA, Ni X, Rollauer SE, Botos I, Tan X, King MS, Kunji ERS, Jiang J, Buchanan SK.","Nat Commun. 2020 Jul 3;11(1):3290. doi: 10.1038/s41467-020-17144-1.","Diederichs KA","Nat Commun","2020","2020/07/05","PMC7335169","","10.1038/s41467-020-17144-1"
"36546909","Enzymatic Oxidation of Ferulic Acid as a Way of Preparing New Derivatives","Aljawish A, Chevalot I, Paris C, Muniglia L.","BioTech (Basel). 2022 Dec 5;11(4):55. doi: 10.3390/biotech11040055.","Aljawish A","BioTech (Basel)","2022","2022/12/22","PMC9775523","","10.3390/biotech11040055"
"34560965","Unique features of the bifunctional GH30 from Thermothelomyces thermophila revealed by structural and mutational studies","Nikolaivits E, Pentari C, Kosinas C, Feiler CG, Spiliopoulou M, Weiss MS, Dimarogona M, Topakas E.","Carbohydr Polym. 2021 Dec 1;273:118553. doi: 10.1016/j.carbpol.2021.118553. Epub 2021 Aug 12.","Nikolaivits E","Carbohydr Polym","2021","2021/09/25","","","10.1016/j.carbpol.2021.118553"
"29317354","Laccase catalyzed elimination of morphine from aqueous systems","Huber D, Bleymaier K, Pellis A, Vielnascher R, Daxbacher A, Greimel KJ, Guebitz GM.","N Biotechnol. 2018 May 25;42:19-25. doi: 10.1016/j.nbt.2018.01.003. Epub 2018 Jan 6.","Huber D","N Biotechnol","2018","2018/01/11","","","10.1016/j.nbt.2018.01.003"
"1506028","Induction and regulation of alpha-amylase synthesis in a cellulolytic thermophilic fungus Myceliophthora thermophila D14 (ATCC 48104)","Sadhukhan R, Roy SK, Raha SK, Manna S, Chakrabarty SL.","Indian J Exp Biol. 1992 Jun;30(6):482-6.","Sadhukhan R","Indian J Exp Biol","1992","1992/06/01","","",""
"29435681","Bio-coloration of bacterial cellulose assisted by immobilized laccase","Song JE, Su J, Noro J, Cavaco-Paulo A, Silva C, Kim HR.","AMB Express. 2018 Feb 13;8(1):19. doi: 10.1186/s13568-018-0552-0.","Song JE","AMB Express","2018","2018/02/14","PMC5809631","","10.1186/s13568-018-0552-0"
"8938783","Posttraumatic gas-containing brain abscess caused by Clostridium perfringens with unique simultaneous fungal suppuration by Myceliophthora thermophila: case report","Tekkök IH, Higgins MJ, Ventureyra EC.","Neurosurgery. 1996 Dec;39(6):1247-51. doi: 10.1097/00006123-199612000-00039.","Tekkök IH","Neurosurgery","1996","1996/12/01","","","10.1097/00006123-199612000-00039"
"28591592","Recombinant thermo-alkali-stable endoglucanase of Myceliopthora thermophila BJA (rMt-egl): Biochemical characteristics and applicability in enzymatic saccharification of agro-residues","Phadtare P, Joshi S, Satyanarayana T.","Int J Biol Macromol. 2017 Nov;104(Pt A):107-116. doi: 10.1016/j.ijbiomac.2017.05.167. Epub 2017 Jun 4.","Phadtare P","Int J Biol Macromol","2017","2017/06/08","","","10.1016/j.ijbiomac.2017.05.167"
"27399259","Structure of chromatin remodeler Swi2/Snf2 in the resting state","Xia X, Liu X, Li T, Fang X, Chen Z.","Nat Struct Mol Biol. 2016 Aug;23(8):722-9. doi: 10.1038/nsmb.3259. Epub 2016 Jul 11.","Xia X","Nat Struct Mol Biol","2016","2016/07/12","","","10.1038/nsmb.3259"
"34921331","Development of a flow cytometry-based plating-free system for strain engineering in industrial fungi","Yang YJ, Liu Y, Liu DD, Guo WZ, Wang LX, Wang XJ, Lv HX, Yang Y, Liu Q, Tian CG.","Appl Microbiol Biotechnol. 2022 Jan;106(2):713-727. doi: 10.1007/s00253-021-11733-w. Epub 2021 Dec 18.","Yang YJ","Appl Microbiol Biotechnol","2022","2021/12/18","","","10.1007/s00253-021-11733-w"
"37278305","Polyphenol Oxidase Products Are Priming Agents For LPMO Peroxygenase Activity","Silva COG, Vuillemin M, Kabel MA, van Berkel WJH, Meyer AS, Wittrup Agger J.","ChemSusChem. 2023 Jun 6:e202300559. doi: 10.1002/cssc.202300559. Online ahead of print.","Silva COG","ChemSusChem","2023","2023/06/06","","","10.1002/cssc.202300559"
