PMID,Title,Authors,Citation,First Author,Journal/Book,Publication Year,Create Date,PMCID,NIHMS ID,DOI
"34155677","Green synthesis of glyco-phenol by enzymatic coupling between ferulic acid and glucosamine: An ecofriendly procedure","Aljawish A, Chevalot I, Paris C, Muniglia L.","Biotechnol Appl Biochem. 2022 Aug;69(4):1438-1450. doi: 10.1002/bab.2215. Epub 2021 Jul 5.","Aljawish A","Biotechnol Appl Biochem","2022","2021/06/22","","","10.1002/bab.2215"
"31110561","A novel fungal GH30 xylanase with xylobiohydrolase auxiliary activity","Katsimpouras C, Dedes G, Thomaidis NS, Topakas E.","Biotechnol Biofuels. 2019 May 11;12:120. doi: 10.1186/s13068-019-1455-2. eCollection 2019.","Katsimpouras C","Biotechnol Biofuels","2019","2019/05/22","PMC6511221","","10.1186/s13068-019-1455-2"
"28649275","Management of enzyme diversity in high-performance cellulolytic cocktails","Reyes-Sosa FM, López Morales M, Platero Gómez AI, Valbuena Crespo N, Sánchez Zamorano L, Rocha-Martín J, Molina-Heredia FP, Díez García B.","Biotechnol Biofuels. 2017 Jun 19;10:156. doi: 10.1186/s13068-017-0845-6. eCollection 2017.","Reyes-Sosa FM","Biotechnol Biofuels","2017","2017/06/27","PMC5477296","","10.1186/s13068-017-0845-6"
"25822992","Atomic structure of the Y complex of the nuclear pore","Kelley K, Knockenhauer KE, Kabachinski G, Schwartz TU.","Nat Struct Mol Biol. 2015 May;22(5):425-431. doi: 10.1038/nsmb.2998. Epub 2015 Mar 30.","Kelley K","Nat Struct Mol Biol","2015","2015/03/31","PMC4424061","NIHMS670580","10.1038/nsmb.2998"
"34513809","Improved Production of Xylanase in Pichia pastoris and Its Application in Xylose Production From Xylan","Miao T, Basit A, Liu J, Zheng F, Rahim K, Lou H, Jiang W.","Front Bioeng Biotechnol. 2021 Aug 27;9:690702. doi: 10.3389/fbioe.2021.690702. eCollection 2021.","Miao T","Front Bioeng Biotechnol","2021","2021/09/13","PMC8429496","","10.3389/fbioe.2021.690702"
"35847290","Role of Surface Enhancement in the Enzymatic Cross-Linking of Lignosulfonate Using Alternative Downstream Techniques","Padhi SSP, Jimenez Bartolome M, Nyanhongo GS, Schwaiger N, Pellis A, van Herwijnen HWG, Guebitz GM.","ACS Omega. 2022 Jun 27;7(27):23749-23758. doi: 10.1021/acsomega.2c02421. eCollection 2022 Jul 12.","Padhi SSP","ACS Omega","2022","2022/07/18","PMC9280766","","10.1021/acsomega.2c02421"
"30395580","A comparative structural analysis of the surface properties of asco-laccases","Ernst HA, Jørgensen LJ, Bukh C, Piontek K, Plattner DA, Østergaard LH, Larsen S, Bjerrum MJ.","PLoS One. 2018 Nov 5;13(11):e0206589. doi: 10.1371/journal.pone.0206589. eCollection 2018.","Ernst HA","PLoS One","2018","2018/11/06","PMC6218047","","10.1371/journal.pone.0206589"
"29196788","Quantification of the catalytic performance of C1-cellulose-specific lytic polysaccharide monooxygenases","Frommhagen M, Westphal AH, Hilgers R, Koetsier MJ, Hinz SWA, Visser J, Gruppen H, van Berkel WJH, Kabel MA.","Appl Microbiol Biotechnol. 2018 Feb;102(3):1281-1295. doi: 10.1007/s00253-017-8541-9. Epub 2017 Dec 2.","Frommhagen M","Appl Microbiol Biotechnol","2018","2017/12/03","PMC5778151","","10.1007/s00253-017-8541-9"
"34771228","Laccase-Mediator System Using a Natural Mediator as a Whitening Agent for the Decolorization of Melanin","Park S, Jung D, Do H, Yun J, Lee D, Hwang S, Lee SH.","Polymers (Basel). 2021 Oct 25;13(21):3671. doi: 10.3390/polym13213671.","Park S","Polymers (Basel)","2021","2021/11/13","PMC8587086","","10.3390/polym13213671"
"27919072","Structure and regulation of the chromatin remodeller ISWI","Yan L, Wang L, Tian Y, Xia X, Chen Z.","Nature. 2016 Dec 15;540(7633):466-469. doi: 10.1038/nature20590. Epub 2016 Dec 5.","Yan L","Nature","2016","2016/12/06","","","10.1038/nature20590"
"36560529","Thermophilic Filamentous Fungus C1-Cell-Cloned SARS-CoV-2-Spike-RBD-Subunit-Vaccine Adjuvanted with Aldydrogel(®)85 Protects K18-hACE2 Mice against Lethal Virus Challenge","Nechooshtan R, Ehrlich S, Vitikainen M, Makovitzki A, Dor E, Marcus H, Hefetz I, Pitel S, Wiebe M, Huuskonen A, Cherry L, Lupu E, Sapir Y, Holtzman T, Aftalion M, Gur D, Tamir H, Yahalom-Ronen Y, Ramot Y, Kronfeld N, Zarling D, Vallerga A, Tchelet R, Nyska A, Saloheimo M, Emalfarb M, Ophir Y.","Vaccines (Basel). 2022 Dec 11;10(12):2119. doi: 10.3390/vaccines10122119.","Nechooshtan R","Vaccines (Basel)","2022","2022/12/23","PMC9783968","","10.3390/vaccines10122119"
"36602562","Laccase multi-point covalent immobilization: characterization, kinetics, and its hydrophobicity applications","Othman AM, Sanromán Á, Moldes D.","Appl Microbiol Biotechnol. 2023 Feb;107(2-3):719-733. doi: 10.1007/s00253-022-12352-9. Epub 2023 Jan 5.","Othman AM","Appl Microbiol Biotechnol","2023","2023/01/05","","","10.1007/s00253-022-12352-9"
"33219291","Quantitative comparison of the biomass-degrading enzyme repertoires of five filamentous fungi","Arntzen MØ, Bengtsson O, Várnai A, Delogu F, Mathiesen G, Eijsink VGH.","Sci Rep. 2020 Nov 20;10(1):20267. doi: 10.1038/s41598-020-75217-z.","Arntzen MØ","Sci Rep","2020","2020/11/21","PMC7679414","","10.1038/s41598-020-75217-z"
"9776822","Fatal aortic Myceliophthora thermophila infection in a patient affected by cystic medial necrosis","Farina C, Gamba A, Tambini R, Beguin H, Trouillet JL.","Med Mycol. 1998 Apr;36(2):113-8.","Farina C","Med Mycol","1998","1998/10/20","","",""
"28935560","Anti-inflammatory and anti-oxidant properties of laccase-synthesized phenolic-O-carboxymethyl chitosan hydrogels","Huber D, Grzelak A, Baumann M, Borth N, Schleining G, Nyanhongo GS, Guebitz GM.","N Biotechnol. 2018 Jan 25;40(Pt B):236-244. doi: 10.1016/j.nbt.2017.09.004. Epub 2017 Sep 19.","Huber D","N Biotechnol","2018","2017/09/23","","","10.1016/j.nbt.2017.09.004"
"26907693","Functional Evolution in Orthologous Cell-encoded RNA-dependent RNA Polymerases","Qian X, Hamid FM, El Sahili A, Darwis DA, Wong YH, Bhushan S, Makeyev EV, Lescar J.","J Biol Chem. 2016 Apr 22;291(17):9295-309. doi: 10.1074/jbc.M115.685933. Epub 2016 Feb 23.","Qian X","J Biol Chem","2016","2016/02/25","PMC4861493","","10.1074/jbc.M115.685933"
"28648174","Functionalization of pectin with laccase-mediated oxidation products of ferulic acid","Karaki N, Aljawish A, Muniglia L, Bouguet-Bonnet S, Leclerc S, Paris C, Jasniewski J, Humeau-Virot C.","Enzyme Microb Technol. 2017 Sep;104:1-8. doi: 10.1016/j.enzmictec.2017.05.001. Epub 2017 May 13.","Karaki N","Enzyme Microb Technol","2017","2017/06/27","","","10.1016/j.enzmictec.2017.05.001"
"35056890","Evaluation of Antibacterial and Antifungal Properties of Low Molecular Weight Chitosan Extracted from Hermetia illucens Relative to Crab Chitosan","Khayrova A, Lopatin S, Shagdarova B, Sinitsyna O, Sinitsyn A, Varlamov V.","Molecules. 2022 Jan 17;27(2):577. doi: 10.3390/molecules27020577.","Khayrova A","Molecules","2022","2022/01/21","PMC8777618","","10.3390/molecules27020577"
"35155404","Enzymatic Oxidation of Ca-Lignosulfonate and Kraft Lignin in Different Lignin-Laccase-Mediator-Systems and MDF Production","Euring M, Ostendorf K, Rühl M, Kües U.","Front Bioeng Biotechnol. 2022 Jan 28;9:788622. doi: 10.3389/fbioe.2021.788622. eCollection 2021.","Euring M","Front Bioeng Biotechnol","2022","2022/02/14","PMC8831759","","10.3389/fbioe.2021.788622"
"34722005","Oxidized Product Profiles of AA9 Lytic Polysaccharide Monooxygenases Depend on the Type of Cellulose","Sun P, Valenzuela SV, Chunkrua P, Javier Pastor FI, Laurent CVFP, Ludwig R, van Berkel WJH, Kabel MA.","ACS Sustain Chem Eng. 2021 Oct 25;9(42):14124-14133. doi: 10.1021/acssuschemeng.1c04100. Epub 2021 Oct 13.","Sun P","ACS Sustain Chem Eng","2021","2021/11/01","PMC8549066","","10.1021/acssuschemeng.1c04100"
"28257189","The Role of the Secondary Coordination Sphere in a Fungal Polysaccharide Monooxygenase","Span EA, Suess DLM, Deller MC, Britt RD, Marletta MA.","ACS Chem Biol. 2017 Apr 21;12(4):1095-1103. doi: 10.1021/acschembio.7b00016. Epub 2017 Mar 3.","Span EA","ACS Chem Biol","2017","2017/03/04","PMC5554615","NIHMS888398","10.1021/acschembio.7b00016"
"31309856","Isolation and characterization of a new cytotoxic polyketide-amino acid hybrid from Thermothelomyces thermophilus ATCC 42464","Gao YL, Zhang ML, Wang X, Zhang HD, Huang JZ, Li L.","Nat Prod Res. 2021 Jun;35(11):1792-1798. doi: 10.1080/14786419.2019.1641810. Epub 2019 Jul 16.","Gao YL","Nat Prod Res","2021","2019/07/17","","","10.1080/14786419.2019.1641810"
"35757805","Modifying Surface Charges of a Thermophilic Laccase Toward Improving Activity and Stability in Ionic Liquid","Stevens JC, Shi J.","Front Bioeng Biotechnol. 2022 Jun 8;10:880795. doi: 10.3389/fbioe.2022.880795. eCollection 2022.","Stevens JC","Front Bioeng Biotechnol","2022","2022/06/27","PMC9213733","","10.3389/fbioe.2022.880795"
"28710860","Coupling the pretreatment and hydrolysis of lignocellulosic biomass by the expression of beta-xylosidases","Martín Pérez L, Benítez Casanova L, Moreno Pérez AJ, Pérez Gómez D, Gavaldá Martín S, Ledesma-García L, Valbuena Crespo N, Díez García B, Reyes-Sosa FM.","Biotechnol Bioeng. 2017 Nov;114(11):2497-2506. doi: 10.1002/bit.26386. Epub 2017 Aug 17.","Martín Pérez L","Biotechnol Bioeng","2017","2017/07/16","","","10.1002/bit.26386"
"25941560","Effect of mutations on the thermostability of Aspergillus aculeatus β-1,4-galactanase","Torpenholt S, De Maria L, Olsson MH, Christensen LH, Skjøt M, Westh P, Jensen JH, Lo Leggio L.","Comput Struct Biotechnol J. 2015 Apr 9;13:256-64. doi: 10.1016/j.csbj.2015.03.010. eCollection 2015.","Torpenholt S","Comput Struct Biotechnol J","2015","2015/05/06","PMC4412966","","10.1016/j.csbj.2015.03.010"
"29887016","Influence of mediators on laccase catalyzed radical formation in lignin","Munk L, Andersen ML, Meyer AS.","Enzyme Microb Technol. 2018 Sep;116:48-56. doi: 10.1016/j.enzmictec.2018.05.009. Epub 2018 May 17.","Munk L","Enzyme Microb Technol","2018","2018/06/12","","","10.1016/j.enzmictec.2018.05.009"
"29274421","Immobilization of laccase on epoxy-functionalized silica and its application in biodegradation of phenolic compounds","Mohammadi M, As'habi MA, Salehi P, Yousefi M, Nazari M, Brask J.","Int J Biol Macromol. 2018 Apr 1;109:443-447. doi: 10.1016/j.ijbiomac.2017.12.102. Epub 2017 Dec 21.","Mohammadi M","Int J Biol Macromol","2018","2017/12/24","","","10.1016/j.ijbiomac.2017.12.102"
"33222033","Improving enzyme production by solid-state cultivation in packed-bed bioreactors by changing bed porosity and airflow distribution","Perez CL, Casciatori FP, Thoméo JC.","Bioprocess Biosyst Eng. 2021 Mar;44(3):537-548. doi: 10.1007/s00449-020-02466-7. Epub 2020 Nov 22.","Perez CL","Bioprocess Biosyst Eng","2021","2020/11/22","","","10.1007/s00449-020-02466-7"
"32065289","Enhanced production of bacterial xylanase and its utility in saccharification of sugarcane bagasse","Alokika, Singh B.","Bioprocess Biosyst Eng. 2020 Jun;43(6):1081-1091. doi: 10.1007/s00449-020-02306-8. Epub 2020 Feb 17.","Alokika","Bioprocess Biosyst Eng","2020","2020/02/18","","","10.1007/s00449-020-02306-8"
"21751397","In situ laccase-assisted overdyeing of denim using flavonoids","Guimarães C, Kim S, Silva C, Cavaco-Paulo A.","Biotechnol J. 2011 Oct;6(10):1272-9. doi: 10.1002/biot.201100201. Epub 2011 Aug 3.","Guimarães C","Biotechnol J","2011","2011/07/14","","","10.1002/biot.201100201"
"33352160","Polymer functionalization through an enzymatic process: Intermediate products characterization and their grafting onto gum Arabic","Vuillemin ME, Muniglia L, Linder M, Bouguet-Bonnet S, Poinsignon S, Dos Santos Morais R, Simard B, Paris C, Michaux F, Jasniewski J.","Int J Biol Macromol. 2021 Feb 1;169:480-491. doi: 10.1016/j.ijbiomac.2020.12.113. Epub 2020 Dec 19.","Vuillemin ME","Int J Biol Macromol","2021","2020/12/22","","","10.1016/j.ijbiomac.2020.12.113"
"30474279","CLR-4, a novel conserved transcription factor for cellulase gene expression in ascomycete fungi","Liu Q, Li J, Gao R, Li J, Ma G, Tian C.","Mol Microbiol. 2019 Feb;111(2):373-394. doi: 10.1111/mmi.14160. Epub 2018 Nov 25.","Liu Q","Mol Microbiol","2019","2018/11/27","","","10.1111/mmi.14160"
"34631225","Accessing Chemo- and Regioselective Benzylic and Aromatic Oxidations by Protein Engineering of an Unspecific Peroxygenase","Knorrscheidt A, Soler J, Hünecke N, Püllmann P, Garcia-Borràs M, Weissenborn MJ.","ACS Catal. 2021 Jun 18;11(12):7327-7338. doi: 10.1021/acscatal.1c00847. Epub 2021 Jun 7.","Knorrscheidt A","ACS Catal","2021","2021/10/11","PMC8496131","","10.1021/acscatal.1c00847"
"20953600","Polyoxometalate/laccase-mediated oxidative polymerization of catechol for textile dyeing","Kim S, Silva C, Evtuguin DV, Gamelas JA, Cavaco-Paulo A.","Appl Microbiol Biotechnol. 2011 Feb;89(4):981-7. doi: 10.1007/s00253-010-2932-5. Epub 2010 Oct 16.","Kim S","Appl Microbiol Biotechnol","2011","2010/10/19","","","10.1007/s00253-010-2932-5"
"28491137","Boosting LPMO-driven lignocellulose degradation by polyphenol oxidase-activated lignin building blocks","Frommhagen M, Mutte SK, Westphal AH, Koetsier MJ, Hinz SWA, Visser J, Vincken JP, Weijers D, van Berkel WJH, Gruppen H, Kabel MA.","Biotechnol Biofuels. 2017 May 10;10:121. doi: 10.1186/s13068-017-0810-4. eCollection 2017.","Frommhagen M","Biotechnol Biofuels","2017","2017/05/12","PMC5424327","","10.1186/s13068-017-0810-4"
"32653619","Enzymatic versatility and thermostability of a new aryl-alcohol oxidase from Thermothelomyces thermophilus M77","Kadowaki MAS, Higasi PMR, de Godoy MO, de Araújo EA, Godoy AS, Prade RA, Polikarpov I.","Biochim Biophys Acta Gen Subj. 2020 Oct;1864(10):129681. doi: 10.1016/j.bbagen.2020.129681. Epub 2020 Jul 10.","Kadowaki MAS","Biochim Biophys Acta Gen Subj","2020","2020/07/13","","","10.1016/j.bbagen.2020.129681"
"23570533","Laccase-mediated coupling of nonpolar chains for the hydrophobization of lignocellulose","Garcia-Ubasart J, Vidal T, Torres AL, Rojas OJ.","Biomacromolecules. 2013 May 13;14(5):1637-44. doi: 10.1021/bm400291s. Epub 2013 Apr 22.","Garcia-Ubasart J","Biomacromolecules","2013","2013/04/11","","","10.1021/bm400291s"
"28805314","Evolved α-factor prepro-leaders for directed laccase evolution in Saccharomyces cerevisiae","Mateljak I, Tron T, Alcalde M.","Microb Biotechnol. 2017 Nov;10(6):1830-1836. doi: 10.1111/1751-7915.12838. Epub 2017 Aug 14.","Mateljak I","Microb Biotechnol","2017","2017/08/15","PMC5658585","","10.1111/1751-7915.12838"
"23788272","Membraneless glucose/oxygen enzymatic fuel cells using redox hydrogel films containing carbon nanotubes","MacAodha D, Ó Conghaile P, Egan B, Kavanagh P, Leech D.","Chemphyschem. 2013 Jul 22;14(10):2302-7. doi: 10.1002/cphc.201300239. Epub 2013 Jun 20.","MacAodha D","Chemphyschem","2013","2013/06/22","","","10.1002/cphc.201300239"
"32380451","FTacV study of electroactive immobilized enzyme/free substrate reactions: Enzymatic catalysis of epinephrine by a multicopper oxidase from Thermothelomyces thermophila","Zouraris D, Kiafi S, Zerva A, Topakas E, Karantonis A.","Bioelectrochemistry. 2020 Aug;134:107538. doi: 10.1016/j.bioelechem.2020.107538. Epub 2020 Apr 28.","Zouraris D","Bioelectrochemistry","2020","2020/05/08","","","10.1016/j.bioelechem.2020.107538"
"31641526","Practical guidance for the implementation of the CRISPR genome editing tool in filamentous fungi","Kwon MJ, Schütze T, Spohner S, Haefner S, Meyer V.","Fungal Biol Biotechnol. 2019 Oct 17;6:15. doi: 10.1186/s40694-019-0079-4. eCollection 2019.","Kwon MJ","Fungal Biol Biotechnol","2019","2019/10/24","PMC6796461","","10.1186/s40694-019-0079-4"
"35214607","The Highly Productive Thermothelomyces heterothallica C1 Expression System as a Host for Rapid Development of Influenza Vaccines","Keresztes G, Baer M, Alfenito MR, Verwoerd TC, Kovalchuk A, Wiebe MG, Andersen TK, Saloheimo M, Tchelet R, Kensinger R, Grødeland G, Emalfarb M.","Vaccines (Basel). 2022 Jan 20;10(2):148. doi: 10.3390/vaccines10020148.","Keresztes G","Vaccines (Basel)","2022","2022/02/26","PMC8877961","","10.3390/vaccines10020148"
"35017571","Berberine bridge enzyme-like oxidase-catalysed double bond isomerization acts as the pathway switch in cytochalasin synthesis","Zhang JM, Liu X, Wei Q, Ma C, Li D, Zou Y.","Nat Commun. 2022 Jan 11;13(1):225. doi: 10.1038/s41467-021-27931-z.","Zhang JM","Nat Commun","2022","2022/01/12","PMC8752850","","10.1038/s41467-021-27931-z"
"26490891","Assessing the use of nanoimmobilized laccases to remove micropollutants from wastewater","Arca-Ramos A, Ammann EM, Gasser CA, Nastold P, Eibes G, Feijoo G, Lema JM, Moreira MT, Corvini PF.","Environ Sci Pollut Res Int. 2016 Feb;23(4):3217-28. doi: 10.1007/s11356-015-5564-6. Epub 2015 Oct 21.","Arca-Ramos A","Environ Sci Pollut Res Int","2016","2015/10/23","","","10.1007/s11356-015-5564-6"
"30465791","Development of host strains and vector system for an efficient genetic transformation of filamentous fungi","Balabanova LA, Shkryl YN, Slepchenko LV, Yugay YA, Gorpenchenko TY, Kirichuk NN, Khudyakova YV, Bakunina IY, Podvolotskaya AB, Bulgakov VP, Seitkalieva AV, Son OM, Tekutyeva LA.","Plasmid. 2019 Jan;101:1-9. doi: 10.1016/j.plasmid.2018.11.002. Epub 2018 Nov 19.","Balabanova LA","Plasmid","2019","2018/11/23","","","10.1016/j.plasmid.2018.11.002"
"23218295","Obtaining biobleached eucalyptus cellulose fibres by using various enzyme combinations","Valls C, Cadena EM, Blanca Roncero M.","Carbohydr Polym. 2013 Jan 30;92(1):276-82. doi: 10.1016/j.carbpol.2012.08.083. Epub 2012 Aug 30.","Valls C","Carbohydr Polym","2013","2012/12/11","","","10.1016/j.carbpol.2012.08.083"
"24031929","Selection of thermophilic and thermotolerant fungi for the production of cellulases and xylanases under solid-state fermentation","Moretti MM, Bocchini-Martins DA, Silva RD, Rodrigues A, Sette LD, Gomes E.","Braz J Microbiol. 2012 Jul;43(3):1062-71. doi: 10.1590/S1517-838220120003000032. Epub 2012 Jun 1.","Moretti MM","Braz J Microbiol","2012","2013/09/14","PMC3768882","","10.1590/S1517-838220120003000032"
"33043425","Effect of Metal Ions on the Activity of Ten NAD-Dependent Formate Dehydrogenases","Bulut H, Valjakka J, Yuksel B, Yilmazer B, Turunen O, Binay B.","Protein J. 2020 Oct;39(5):519-530. doi: 10.1007/s10930-020-09924-x. Epub 2020 Oct 12.","Bulut H","Protein J","2020","2020/10/12","","","10.1007/s10930-020-09924-x"
"27856189","N-Linked glycans are an important component of the processive machinery of cellobiohydrolases","Gusakov AV, Dotsenko AS, Rozhkova AM, Sinitsyn AP.","Biochimie. 2017 Jan;132:102-108. doi: 10.1016/j.biochi.2016.11.004. Epub 2016 Nov 14.","Gusakov AV","Biochimie","2017","2016/11/19","","","10.1016/j.biochi.2016.11.004"
"33712158","Light-stimulated T. thermophilus two-domain LPMO9H: Low-resolution SAXS model and synergy with cellulases","Higasi PMR, Velasco JA, Pellegrini VOA, de Araújo EA, França BA, Keller MB, Labate CA, Blossom BM, Segato F, Polikarpov I.","Carbohydr Polym. 2021 May 15;260:117814. doi: 10.1016/j.carbpol.2021.117814. Epub 2021 Feb 15.","Higasi PMR","Carbohydr Polym","2021","2021/03/13","","","10.1016/j.carbpol.2021.117814"
"20176477","Polymerization of lignosulfonates by the laccase-HBT (1-hydroxybenzotriazole) system improves dispersibility","Nugroho Prasetyo E, Kudanga T, Østergaard L, Rencoret J, Gutiérrez A, del Río JC, Ignacio Santos J, Nieto L, Jiménez-Barbero J, Martínez AT, Li J, Gellerstedt G, Lepifre S, Silva C, Kim SY, Cavaco-Paulo A, Seljebakken Klausen B, Lutnaes BF, Nyanhongo GS, Guebitz GM.","Bioresour Technol. 2010 Jul;101(14):5054-62. doi: 10.1016/j.biortech.2010.01.048. Epub 2010 Feb 21.","Nugroho Prasetyo E","Bioresour Technol","2010","2010/02/24","","","10.1016/j.biortech.2010.01.048"
"32300998","A simple approach to mediate genome editing in the filamentous fungus Trichoderma reesei by CRISPR/Cas9-coupled in vivo gRNA transcription","Wu C, Chen Y, Qiu Y, Niu X, Zhu N, Chen J, Yao H, Wang W, Ma Y.","Biotechnol Lett. 2020 Jul;42(7):1203-1210. doi: 10.1007/s10529-020-02887-0. Epub 2020 Apr 16.","Wu C","Biotechnol Lett","2020","2020/04/18","","","10.1007/s10529-020-02887-0"
"30125627","Covalent immobilization of laccase by one pot three component reaction and its application in the decolorization of textile dyes","Salami F, Habibi Z, Yousefi M, Mohammadi M.","Int J Biol Macromol. 2018 Dec;120(Pt A):144-151. doi: 10.1016/j.ijbiomac.2018.08.077. Epub 2018 Aug 17.","Salami F","Int J Biol Macromol","2018","2018/08/21","","","10.1016/j.ijbiomac.2018.08.077"
"31131710","Peptides with antioxidant properties identified from casein, whey, and egg albumin hydrolysates generated by two novel fungal proteases","Neto YAAH, Rosa JC, Cabral H.","Prep Biochem Biotechnol. 2019;49(7):639-648. doi: 10.1080/10826068.2019.1566147. Epub 2019 May 25.","Neto YAAH","Prep Biochem Biotechnol","2019","2019/05/28","","","10.1080/10826068.2019.1566147"
"25724976","Enhanced biological straw saccharification through coculturing of lignocellulose-degrading microorganisms","Taha M, Shahsavari E, Al-Hothaly K, Mouradov A, Smith AT, Ball AS, Adetutu EM.","Appl Biochem Biotechnol. 2015 Apr;175(8):3709-28. doi: 10.1007/s12010-015-1539-9. Epub 2015 Feb 28.","Taha M","Appl Biochem Biotechnol","2015","2015/03/01","","","10.1007/s12010-015-1539-9"
"23911459","The influence of the primary and secondary xanthan structure on the enzymatic hydrolysis of the xanthan backbone","Kool MM, Schols HA, Delahaije RJ, Sworn G, Wierenga PA, Gruppen H.","Carbohydr Polym. 2013 Sep 12;97(2):368-75. doi: 10.1016/j.carbpol.2013.05.045. Epub 2013 May 25.","Kool MM","Carbohydr Polym","2013","2013/08/06","","","10.1016/j.carbpol.2013.05.045"
"28576392","Enzymatic tailoring of oleuropein from Olea europaea leaves and product identification by HRMS/MS spectrometry","Nikolaivits E, Termentzi A, Skaltsounis AL, Fokialakis N, Topakas E.","J Biotechnol. 2017 Jul 10;253:48-54. doi: 10.1016/j.jbiotec.2017.05.020. Epub 2017 May 30.","Nikolaivits E","J Biotechnol","2017","2017/06/04","","","10.1016/j.jbiotec.2017.05.020"
"32866595","Molecular dynamics simulations of two GH74 endo-processive xyloglucanases and the mutated variants to understand better the mechanism of the enzyme action","Gusakov AV, Uporov IV, Sinitsyna OA.","Biochim Biophys Acta Gen Subj. 2020 Dec;1864(12):129721. doi: 10.1016/j.bbagen.2020.129721. Epub 2020 Aug 29.","Gusakov AV","Biochim Biophys Acta Gen Subj","2020","2020/09/01","","","10.1016/j.bbagen.2020.129721"
"30966676","Green Binder Based on Enzymatically Polymerized Eucalypt Kraft Lignin for Fiberboard Manufacturing: A Preliminary Study","Gouveia S, Otero LA, Fernández-Costas C, Filgueira D, Sanromán Á, Moldes D.","Polymers (Basel). 2018 Jun 9;10(6):642. doi: 10.3390/polym10060642.","Gouveia S","Polymers (Basel)","2018","2019/04/11","PMC6403738","","10.3390/polym10060642"
"24880600","Autochthonous ascomycetes in depollution of polychlorinated biphenyls contaminated soil and sediment","Sage L, Périgon S, Faure M, Gaignaire C, Abdelghafour M, Mehu J, Geremia RA, Mouhamadou B.","Chemosphere. 2014 Sep;110:62-9. doi: 10.1016/j.chemosphere.2014.03.013. Epub 2014 Apr 22.","Sage L","Chemosphere","2014","2014/06/02","","","10.1016/j.chemosphere.2014.03.013"
"24948946","Filamentous fungi and media for cellulase production in solid state cultures","Kilikian BV, Afonso LC, Souza TF, Ferreira RG, Pinheiro IR.","Braz J Microbiol. 2014 Apr 11;45(1):279-86. doi: 10.1590/S1517-83822014005000028. eCollection 2014.","Kilikian BV","Braz J Microbiol","2014","2014/06/21","PMC4059312","","10.1590/S1517-83822014005000028"
"34153346","Survival of thermophilic fungi in various preservation methods: A comparative study","Berikten D.","Cryobiology. 2021 Aug;101:38-43. doi: 10.1016/j.cryobiol.2021.06.005. Epub 2021 Jun 18.","Berikten D","Cryobiology","2021","2021/06/21","","","10.1016/j.cryobiol.2021.06.005"
"27297903","Isolation of Homogeneous Polysaccharide Monooxygenases from Fungal Sources and Investigation of Their Synergism with Cellulases when Acting on Cellulose","Bulakhov AG, Gusakov AV, Chekushina AV, Satrutdinov AD, Koshelev AV, Matys VY, Sinitsyn AP.","Biochemistry (Mosc). 2016 May;81(5):530-7. doi: 10.1134/S0006297916050102.","Bulakhov AG","Biochemistry (Mosc)","2016","2016/06/15","","","10.1134/S0006297916050102"
"21524087","Evaluation of the potential of fungal and plant laccases for active-packaging applications","Chatterjee R, Johansson K, Järnström L, Jönsson LJ.","J Agric Food Chem. 2011 May 25;59(10):5390-5. doi: 10.1021/jf103811g. Epub 2011 Apr 27.","Chatterjee R","J Agric Food Chem","2011","2011/04/29","","","10.1021/jf103811g"
"25644433","Thermophilic fungi as new sources for production of cellulases and xylanases with potential use in sugarcane bagasse saccharification","de Cassia Pereira J, Paganini Marques N, Rodrigues A, Brito de Oliveira T, Boscolo M, da Silva R, Gomes E, Bocchini Martins DA.","J Appl Microbiol. 2015 Apr;118(4):928-39. doi: 10.1111/jam.12757. Epub 2015 Feb 4.","de Cassia Pereira J","J Appl Microbiol","2015","2015/02/04","","","10.1111/jam.12757"
"36506193","Identification of Thermostable Xylose Reductase from Thermothelomyces thermophilus: A Biochemical Characterization Approach to Meet Biofuel Challenges","Ali N, Aiman A, Shamsi A, Hassan I, Shahid M, Gaur NA, Islam A.","ACS Omega. 2022 Nov 17;7(48):44241-44250. doi: 10.1021/acsomega.2c05690. eCollection 2022 Dec 6.","Ali N","ACS Omega","2022","2022/12/12","PMC9730754","","10.1021/acsomega.2c05690"
"23795296","Scaffold nucleoporins Nup188 and Nup192 share structural and functional properties with nuclear transport receptors","Andersen KR, Onischenko E, Tang JH, Kumar P, Chen JZ, Ulrich A, Liphardt JT, Weis K, Schwartz TU.","Elife. 2013 Jun 11;2:e00745. doi: 10.7554/eLife.00745.","Andersen KR","Elife","2013","2013/06/25","PMC3679522","","10.7554/eLife.00745"
