PMID,Title,Authors,Citation,First Author,Journal/Book,Publication Year,Create Date,PMCID,NIHMS ID,DOI
"26909078","Development of Thermophilic Tailor-Made Enzyme Mixtures for the Bioconversion of Agricultural and Forest Residues","Karnaouri A, Matsakas L, Topakas E, Rova U, Christakopoulos P.","Front Microbiol. 2016 Feb 16;7:177. doi: 10.3389/fmicb.2016.00177. eCollection 2016.","Karnaouri A","Front Microbiol","2016","2016/02/25","PMC4754399","","10.3389/fmicb.2016.00177"
"18695937","Laccase-catalyzed carbon-nitrogen bond formation: coupling and derivatization of unprotected L-phenylalanine with different para-hydroquinones","Hahn V, Mikolasch A, Manda K, Gördes D, Thurow K, Schauer F.","Amino Acids. 2009 Jul;37(2):315-21. doi: 10.1007/s00726-008-0154-2. Epub 2008 Aug 10.","Hahn V","Amino Acids","2009","2008/08/13","","","10.1007/s00726-008-0154-2"
"22858477","Enzymatic polymerisation and effect of fractionation of dissolved lignin from Eucalyptus globulus Kraft liquor","Gouveia S, Fernández-Costas C, Sanromán MA, Moldes D.","Bioresour Technol. 2012 Oct;121:131-8. doi: 10.1016/j.biortech.2012.05.144. Epub 2012 Jul 11.","Gouveia S","Bioresour Technol","2012","2012/08/04","","","10.1016/j.biortech.2012.05.144"
"15354533","Evaluation of certain food additives and contaminants","","World Health Organ Tech Rep Ser. 2004;922:1-176.","","World Health Organ Tech Rep Ser","2004","2004/09/10","","",""
"30396396","Functional characterization and comparative analysis of two heterologous endoglucanases from diverging subfamilies of glycosyl hydrolase family 45","Berto GL, Velasco J, Tasso Cabos Ribeiro C, Zanphorlin LM, Noronha Domingues M, Tyago Murakami M, Polikarpov I, de Oliveira LC, Ferraz A, Segato F.","Enzyme Microb Technol. 2019 Jan;120:23-35. doi: 10.1016/j.enzmictec.2018.09.005. Epub 2018 Sep 27.","Berto GL","Enzyme Microb Technol","2019","2018/11/07","","","10.1016/j.enzmictec.2018.09.005"
"29100178","Monitoring of reactions catalyzed by lytic polysaccharide monooxygenases using highly-sensitive fluorimetric assay of the oxygen consumption rate","Gusakov AV, Bulakhov AG, Demin IN, Sinitsyn AP.","Carbohydr Res. 2017 Nov 27;452:156-161. doi: 10.1016/j.carres.2017.10.015. Epub 2017 Oct 24.","Gusakov AV","Carbohydr Res","2017","2017/11/04","","","10.1016/j.carres.2017.10.015"
"30986238","Conductive bacterial cellulose by in situ laccase polymerization of aniline","Shim E, Su J, Noro J, Teixeira MA, Cavaco-Paulo A, Silva C, Kim HR.","PLoS One. 2019 Apr 15;14(4):e0214546. doi: 10.1371/journal.pone.0214546. eCollection 2019.","Shim E","PLoS One","2019","2019/04/16","PMC6464183","","10.1371/journal.pone.0214546"
"33292403","Characterization of an AA9 LPMO from Thielavia australiensis, TausLPMO9B, under industrially relevant lignocellulose saccharification conditions","Calderaro F, Keser M, Akeroyd M, Bevers LE, Eijsink VGH, Várnai A, van den Berg MA.","Biotechnol Biofuels. 2020 Nov 30;13(1):195. doi: 10.1186/s13068-020-01836-3.","Calderaro F","Biotechnol Biofuels","2020","2020/12/09","PMC7706046","","10.1186/s13068-020-01836-3"
"16080184","Laccase-catalysed iodide oxidation in presence of methyl syringate","Kulys J, Bratkovskaja I, Vidziunaite R.","Biotechnol Bioeng. 2005 Oct 5;92(1):124-8. doi: 10.1002/bit.20610.","Kulys J","Biotechnol Bioeng","2005","2005/08/05","","","10.1002/bit.20610"
"19788410","Synthesis of model morpholine derivatives with biological activities by laccase-catalysed reactions","Hahn V, Mikolasch A, Wende K, Bartrow H, Lindequist U, Schauer F.","Biotechnol Appl Biochem. 2009 Nov 13;54(4):187-95. doi: 10.1042/BA20090219.","Hahn V","Biotechnol Appl Biochem","2009","2009/10/01","","","10.1042/BA20090219"
"33521846","Strategic aromatic residues in the catalytic cleft of the xyloglucanase MtXgh74 modifying thermostability, mode of enzyme action, and viscosity reduction ability","Berezina OV, Rykov SV, Polyakova AK, Bozdaganyan ME, Sidochenko AV, Baudrexl M, Schwarz WH, Zverlov VV, Yarotsky SV.","Appl Microbiol Biotechnol. 2021 Feb;105(4):1461-1476. doi: 10.1007/s00253-021-11106-3. Epub 2021 Feb 1.","Berezina OV","Appl Microbiol Biotechnol","2021","2021/02/01","","","10.1007/s00253-021-11106-3"
"23841747","Understanding pulp delignification by laccase-mediator systems through isolation and characterization of lignin-carbohydrate complexes","Du X, Li J, Gellerstedt G, Rencoret J, Del Río JC, Martínez AT, Gutiérrez A.","Biomacromolecules. 2013 Sep 9;14(9):3073-80. doi: 10.1021/bm4006936. Epub 2013 Aug 14.","Du X","Biomacromolecules","2013","2013/07/12","","","10.1021/bm4006936"
"34771293","Screening of Lignocellulolytic Enzyme Activities in Fungal Species and Sequential Solid-State and Submerged Cultivation for the Production of Enzyme Cocktails","Marđetko N, Trontel A, Novak M, Pavlečić M, Ljubas BD, Grubišić M, Tominac VP, Ludwig R, Šantek B.","Polymers (Basel). 2021 Oct 28;13(21):3736. doi: 10.3390/polym13213736.","Marđetko N","Polymers (Basel)","2021","2021/11/13","PMC8588072","","10.3390/polym13213736"
"36771814","Enzyme-Catalyzed Polymerization of Kraft Lignin from Eucalyptus globulus: Comparison of Bacterial and Fungal Laccases Efficacy","García-Fuentevilla L, Domínguez G, Martín-Sampedro R, Hernández M, Arias ME, Santos JI, Ibarra D, Eugenio ME.","Polymers (Basel). 2023 Jan 18;15(3):513. doi: 10.3390/polym15030513.","García-Fuentevilla L","Polymers (Basel)","2023","2023/02/11","PMC9920240","","10.3390/polym15030513"
"28859815","Direct rate assessment of laccase catalysed radical formation in lignin by electron paramagnetic resonance spectroscopy","Munk L, Andersen ML, Meyer AS.","Enzyme Microb Technol. 2017 Nov;106:88-96. doi: 10.1016/j.enzmictec.2017.07.006. Epub 2017 Jul 14.","Munk L","Enzyme Microb Technol","2017","2017/09/02","","","10.1016/j.enzmictec.2017.07.006"
"28750348","A comparative study on the activity of fungal lytic polysaccharide monooxygenases for the depolymerization of cellulose in soybean spent flakes","Pierce BC, Agger JW, Zhang Z, Wichmann J, Meyer AS.","Carbohydr Res. 2017 Sep 8;449:85-94. doi: 10.1016/j.carres.2017.07.004. Epub 2017 Jul 18.","Pierce BC","Carbohydr Res","2017","2017/07/28","","","10.1016/j.carres.2017.07.004"
"32586235","Creation of Chitinase Producer and Disruption of Micromycete Cell Wall with the Obtained Enzyme Preparation","Sinitsyna OA, Rubtsova EA, Sinelnikov IG, Osipov DO, Rozhkova AM, Matys VY, Bubnova TV, Nemashkalov VA, Sereda AS, Tcsherbakova LA, Sinitsyn AP.","Biochemistry (Mosc). 2020 Jun;85(6):717-724. doi: 10.1134/S0006297920060097.","Sinitsyna OA","Biochemistry (Mosc)","2020","2020/06/27","","","10.1134/S0006297920060097"
"21903143","Oxidation of galactomannan by laccase plus TEMPO yields an elastic gel","Lavazza M, Formantici C, Langella V, Monti D, Pfeiffer U, Galante YM.","J Biotechnol. 2011 Nov 10;156(2):108-16. doi: 10.1016/j.jbiotec.2011.08.029. Epub 2011 Aug 27.","Lavazza M","J Biotechnol","2011","2011/09/10","","","10.1016/j.jbiotec.2011.08.029"
"2793591","Isolation and characterization of new thiol protease inhibitors estatins A and B","Yaginuma S, Asahi A, Morishita A, Hayashi M, Tsujino M, Takada M.","J Antibiot (Tokyo). 1989 Sep;42(9):1362-9. doi: 10.7164/antibiotics.42.1362.","Yaginuma S","J Antibiot (Tokyo)","1989","1989/09/01","","","10.7164/antibiotics.42.1362"
"32871114","Function-related asymmetry of the specific cardiolipin binding sites on the mitochondrial ADP/ATP carrier","Mao X, Yao S, Yi Q, Xu ZM, Cang X.","Biochim Biophys Acta Biomembr. 2021 Jan 1;1863(1):183466. doi: 10.1016/j.bbamem.2020.183466. Epub 2020 Aug 29.","Mao X","Biochim Biophys Acta Biomembr","2021","2020/09/02","","","10.1016/j.bbamem.2020.183466"
"11694062","Dioxygen reactivity of laccase: dependence on laccase source, pH, and anion inhibition","Xu F.","Appl Biochem Biotechnol. 2001 Aug;95(2):125-33. doi: 10.1385/abab:95:2:125.","Xu F","Appl Biochem Biotechnol","2001","2001/11/06","","","10.1385/abab:95:2:125"
"17329882","Novel cephalosporins synthesized by amination of 2,5-dihydroxybenzoic acid derivatives using fungal laccases II","Mikolasch A, Niedermeyer TH, Lalk M, Witt S, Seefeldt S, Hammer E, Schauer F, Gesell Salazar M, Hessel S, Jülich WD, Lindequist U.","Chem Pharm Bull (Tokyo). 2007 Mar;55(3):412-6. doi: 10.1248/cpb.55.412.","Mikolasch A","Chem Pharm Bull (Tokyo)","2007","2007/03/03","","","10.1248/cpb.55.412"
"12485779","Amperometric biosensors based on recombinant laccases for phenols determination","Kulys J, Vidziunaite R.","Biosens Bioelectron. 2003 Mar;18(2-3):319-25. doi: 10.1016/s0956-5663(02)00172-0.","Kulys J","Biosens Bioelectron","2003","2002/12/18","","","10.1016/s0956-5663(02)00172-0"
"9693103","Site-directed mutations in fungal laccase: effect on redox potential, activity and pH profile","Xu F, Berka RM, Wahleithner JA, Nelson BA, Shuster JR, Brown SH, Palmer AE, Solomon EI.","Biochem J. 1998 Aug 15;334 ( Pt 1)(Pt 1):63-70. doi: 10.1042/bj3340063.","Xu F","Biochem J","1998","1998/08/07","PMC1219662","","10.1042/bj3340063"
"21919219","Immobilization of laccase by encapsulation in a sol-gel matrix and its characterization and use for the removal of estrogens","Lloret L, Eibes G, Feijoo G, Moreira MT, Lema JM, Hollmann F.","Biotechnol Prog. 2011 Nov-Dec;27(6):1570-9. doi: 10.1002/btpr.694. Epub 2011 Sep 14.","Lloret L","Biotechnol Prog","2011","2011/09/16","","","10.1002/btpr.694"
"12571021","Functional expression of a fungal laccase in Saccharomyces cerevisiae by directed evolution","Bulter T, Alcalde M, Sieber V, Meinhold P, Schlachtbauer C, Arnold FH.","Appl Environ Microbiol. 2003 Feb;69(2):987-95. doi: 10.1128/AEM.69.2.987-995.2003.","Bulter T","Appl Environ Microbiol","2003","2003/02/07","PMC143632","","10.1128/AEM.69.2.987-995.2003"
"34168079","The F-box protein gene exo-1 is a target for reverse engineering enzyme hypersecretion in filamentous fungi","Gabriel R, Thieme N, Liu Q, Li F, Meyer LT, Harth S, Jecmenica M, Ramamurthy M, Gorman J, Simmons BA, McCluskey K, Baker SE, Tian C, Schuerg T, Singer SW, Fleißner A, Benz JP.","Proc Natl Acad Sci U S A. 2021 Jun 29;118(26):e2025689118. doi: 10.1073/pnas.2025689118.","Gabriel R","Proc Natl Acad Sci U S A","2021","2021/06/25","PMC8256007","","10.1073/pnas.2025689118"
"19646732","Oxidation of the erythro and threo forms of the phenolic lignin model compound 1-(4-hydroxy-3-methoxyphenyl)-2-(2-methoxyphenoxy)-1,3-propanediol by laccases and model oxidants","Bohlin C, Lundquist K, Jönsson LJ.","Bioorg Chem. 2009 Oct;37(5):143-8. doi: 10.1016/j.bioorg.2009.07.001. Epub 2009 Jul 10.","Bohlin C","Bioorg Chem","2009","2009/08/04","","","10.1016/j.bioorg.2009.07.001"
"12033819","Formation of bound residues of 8-hydroxybentazon by oxidoreductive catalysts in soil","Kim JS, Park JW, Lee SE, Kim JE.","J Agric Food Chem. 2002 Jun 5;50(12):3507-11. doi: 10.1021/jf011504z.","Kim JS","J Agric Food Chem","2002","2002/05/30","","","10.1021/jf011504z"
"17168677","Combinatorial saturation mutagenesis by in vivo overlap extension for the engineering of fungal laccases","Alcalde M, Zumárraga M, Polaina J, Ballesteros A, Plou FJ.","Comb Chem High Throughput Screen. 2006 Dec;9(10):719-27. doi: 10.2174/138620706779026079.","Alcalde M","Comb Chem High Throughput Screen","2006","2006/12/16","","","10.2174/138620706779026079"
"26185526","Discovery of the combined oxidative cleavage of plant xylan and cellulose by a new fungal polysaccharide monooxygenase","Frommhagen M, Sforza S, Westphal AH, Visser J, Hinz SW, Koetsier MJ, van Berkel WJ, Gruppen H, Kabel MA.","Biotechnol Biofuels. 2015 Jul 17;8:101. doi: 10.1186/s13068-015-0284-1. eCollection 2015.","Frommhagen M","Biotechnol Biofuels","2015","2015/07/18","PMC4504452","","10.1186/s13068-015-0284-1"
"12761390","Structure of two fungal beta-1,4-galactanases: searching for the basis for temperature and pH optimum","Le Nours J, Ryttersgaard C, Lo Leggio L, Østergaard PR, Borchert TV, Christensen LL, Larsen S.","Protein Sci. 2003 Jun;12(6):1195-204. doi: 10.1110/ps.0300103.","Le Nours J","Protein Sci","2003","2003/05/23","PMC2323896","","10.1110/ps.0300103"
"28884503","Efficient secretion of three fungal laccases from Saccharomyces cerevisiae and their potential for decolorization of textile industry effluent-A comparative study","Antošová Z, Herkommerová K, Pichová I, Sychrová H.","Biotechnol Prog. 2018 Jan;34(1):69-80. doi: 10.1002/btpr.2559. Epub 2017 Oct 5.","Antošová Z","Biotechnol Prog","2018","2017/09/09","","","10.1002/btpr.2559"
"14599353","Colorimetric assays for biodegradation of polycyclic aromatic hydrocarbons by fungal laccases","Alcalde M, Bulter T, Arnold FH.","J Biomol Screen. 2002 Dec;7(6):547-53. doi: 10.1177/1087057102238629.","Alcalde M","J Biomol Screen","2002","2003/11/06","","","10.1177/1087057102238629"
"24401177","Pretreatment with laccase and a phenolic mediator degrades lignin and enhances saccharification of Eucalyptus feedstock","Rico A, Rencoret J, Del Río JC, Martínez AT, Gutiérrez A.","Biotechnol Biofuels. 2014 Jan 8;7(1):6. doi: 10.1186/1754-6834-7-6.","Rico A","Biotechnol Biofuels","2014","2014/01/10","PMC3917704","","10.1186/1754-6834-7-6"
"15760179","Nuclear amination catalyzed by fungal laccases: reaction products of p-hydroquinones and primary aromatic amines","Niedermeyer TH, Mikolasch A, Lalk M.","J Org Chem. 2005 Mar 18;70(6):2002-8. doi: 10.1021/jo048454s.","Niedermeyer TH","J Org Chem","2005","2005/03/12","","","10.1021/jo048454s"
"33905799","Isolation and modification of nano-scale cellulose from organosolv-treated birch through the synergistic activity of LPMO and endoglucanases","Muraleedharan MN, Karnaouri A, Piatkova M, Ruiz-Caldas MX, Matsakas L, Liu B, Rova U, Christakopoulos P, Mathew AP.","Int J Biol Macromol. 2021 Jul 31;183:101-109. doi: 10.1016/j.ijbiomac.2021.04.136. Epub 2021 Apr 24.","Muraleedharan MN","Int J Biol Macromol","2021","2021/04/27","","","10.1016/j.ijbiomac.2021.04.136"
"33741634","Considerations Regarding Activity Determinants of Fungal Polyphenol Oxidases Based on Mutational and Structural Studies","Nikolaivits E, Valmas A, Dedes G, Topakas E, Dimarogona M.","Appl Environ Microbiol. 2021 May 11;87(11):e00396-21. doi: 10.1128/AEM.00396-21. Print 2021 May 11.","Nikolaivits E","Appl Environ Microbiol","2021","2021/03/20","PMC8208164","","10.1128/AEM.00396-21"
"33461124","Fed-batch production of Thermothelomyces thermophilus lignin peroxidase using a recombinant Aspergillus nidulans strain in stirred-tank bioreactor","Liu E, Segato F, Wilkins MR.","Bioresour Technol. 2021 Apr;325:124700. doi: 10.1016/j.biortech.2021.124700. Epub 2021 Jan 12.","Liu E","Bioresour Technol","2021","2021/01/18","","","10.1016/j.biortech.2021.124700"
"24929309","Production of cellobiose dehydrogenase from a newly isolated white rot fungus Termitomyces sp. OE147","Gupta G, Gangwar R, Gautam A, Kumar L, Dhariwal A, Sahai V, Mishra S.","Appl Biochem Biotechnol. 2014 Aug;173(8):2099-115. doi: 10.1007/s12010-014-1010-3. Epub 2014 Jun 15.","Gupta G","Appl Biochem Biotechnol","2014","2014/06/16","","","10.1007/s12010-014-1010-3"
"18292878","An assessment of the relative contributions of redox and steric issues to laccase specificity towards putative substrates","Tadesse MA, D'Annibale A, Galli C, Gentili P, Sergi F.","Org Biomol Chem. 2008 Mar 7;6(5):868-78. doi: 10.1039/b716002j. Epub 2008 Jan 17.","Tadesse MA","Org Biomol Chem","2008","2008/02/23","","","10.1039/b716002j"
"34489024","Kinetic and thermodynamic study of laccase cross-linked onto glyoxyl Immobead 150P carrier: Characterization and application for beechwood biografting","Othman AM, Sanromán MÁ, Moldes D.","Enzyme Microb Technol. 2021 Oct;150:109865. doi: 10.1016/j.enzmictec.2021.109865. Epub 2021 Jul 1.","Othman AM","Enzyme Microb Technol","2021","2021/09/07","","","10.1016/j.enzmictec.2021.109865"
"22038613","Immobilisation of laccase on Eupergit supports and its application for the removal of endocrine disrupting chemicals in a packed-bed reactor","Lloret L, Hollmann F, Eibes G, Feijoo G, Moreira MT, Lema JM.","Biodegradation. 2012 Jun;23(3):373-86. doi: 10.1007/s10532-011-9516-7. Epub 2011 Oct 29.","Lloret L","Biodegradation","2012","2011/11/01","","","10.1007/s10532-011-9516-7"
"16103414","Screening mutant libraries of fungal laccases in the presence of organic solvents","Alcalde M, Bulter T, Zumárraga M, García-Arellano H, Mencía M, Plou FJ, Ballesteros A.","J Biomol Screen. 2005 Sep;10(6):624-31. doi: 10.1177/1087057105277058. Epub 2005 Aug 15.","Alcalde M","J Biomol Screen","2005","2005/08/17","","","10.1177/1087057105277058"
"16599567","Efficiency of new fungal cellulase systems in boosting enzymatic degradation of barley straw lignocellulose","Rosgaard L, Pedersen S, Cherry JR, Harris P, Meyer AS.","Biotechnol Prog. 2006 Mar-Apr;22(2):493-8. doi: 10.1021/bp050361o.","Rosgaard L","Biotechnol Prog","2006","2006/04/08","","","10.1021/bp050361o"
"24128582","Laccase-catalysed oxidation of ferulic acid and ethyl ferulate in aqueous medium: a green procedure for the synthesis of new compounds","Aljawish A, Chevalot I, Jasniewski J, Paris C, Scher J, Muniglia L.","Food Chem. 2014 Feb 15;145:1046-54. doi: 10.1016/j.foodchem.2013.07.119. Epub 2013 Jul 31.","Aljawish A","Food Chem","2014","2013/10/17","","","10.1016/j.foodchem.2013.07.119"
"12226723","Redox-mediated decolorization of synthetic dyes by fungal laccases","Claus H, Faber G, König H.","Appl Microbiol Biotechnol. 2002 Sep;59(6):672-8. doi: 10.1007/s00253-002-1047-z. Epub 2002 Jul 26.","Claus H","Appl Microbiol Biotechnol","2002","2002/09/13","","","10.1007/s00253-002-1047-z"
"10347057","Comparison of fungal laccases and redox mediators in oxidation of a nonphenolic lignin model compound","Li K, Xu F, Eriksson KE.","Appl Environ Microbiol. 1999 Jun;65(6):2654-60. doi: 10.1128/AEM.65.6.2654-2660.1999.","Li K","Appl Environ Microbiol","1999","1999/05/29","PMC91392","","10.1128/AEM.65.6.2654-2660.1999"
"9925555","Biochemical characterization of fungal phytases (myo-inositol hexakisphosphate phosphohydrolases): catalytic properties","Wyss M, Brugger R, Kronenberger A, Rémy R, Fimbel R, Oesterhelt G, Lehmann M, van Loon AP.","Appl Environ Microbiol. 1999 Feb;65(2):367-73. doi: 10.1128/AEM.65.2.367-373.1999.","Wyss M","Appl Environ Microbiol","1999","1999/01/30","PMC91034","","10.1128/AEM.65.2.367-373.1999"
"25841015","Functional Analysis of Two l-Arabinose Transporters from Filamentous Fungi Reveals Promising Characteristics for Improved Pentose Utilization in Saccharomyces cerevisiae","Li J, Xu J, Cai P, Wang B, Ma Y, Benz JP, Tian C.","Appl Environ Microbiol. 2015 Jun 15;81(12):4062-70. doi: 10.1128/AEM.00165-15. Epub 2015 Apr 3.","Li J","Appl Environ Microbiol","2015","2015/04/05","PMC4524138","","10.1128/AEM.00165-15"
"33301505","Safety evaluation of a β-mannanase enzyme preparation produced with Thermothelomyces thermophilus expressing a protein-engineered β-mannanase gene","Kern A, Shanahan D, Buesen R, Geiger D.","PLoS One. 2020 Dec 10;15(12):e0243647. doi: 10.1371/journal.pone.0243647. eCollection 2020.","Kern A","PLoS One","2020","2020/12/10","PMC7728267","","10.1371/journal.pone.0243647"
"23622721","Potential of autochthonous fungal strains isolated from contaminated soils for degradation of polychlorinated biphenyls","Mouhamadou B, Faure M, Sage L, Marçais J, Souard F, Geremia RA.","Fungal Biol. 2013 Apr;117(4):268-74. doi: 10.1016/j.funbio.2013.02.004. Epub 2013 Mar 14.","Mouhamadou B","Fungal Biol","2013","2013/04/30","","","10.1016/j.funbio.2013.02.004"
"25295862","Enhancement of synthetic Trichoderma-based enzyme mixtures for biomass conversion with an alternative family 5 glycosyl hydrolase from Sporotrichum thermophile","Ye Z, Zheng Y, Li B, Borrusch MS, Storms R, Walton JD.","PLoS One. 2014 Oct 8;9(10):e109885. doi: 10.1371/journal.pone.0109885. eCollection 2014.","Ye Z","PLoS One","2014","2014/10/09","PMC4190410","","10.1371/journal.pone.0109885"
"30960948","Conductive Cotton by In Situ Laccase-Polymerization of Aniline","Su J, Shim E, Noro J, Fu J, Wang Q, Kim HR, Silva C, Cavaco-Paulo A.","Polymers (Basel). 2018 Sep 14;10(9):1023. doi: 10.3390/polym10091023.","Su J","Polymers (Basel)","2018","2019/04/10","PMC6403699","","10.3390/polym10091023"
"22633202","Thermal denaturation of a blue-copper laccase: formation of a compact denatured state with residual structure linked to pH changes in the region of histidine protonation","Toledo-Núñez C, López-Cruz JI, Hernández-Arana A.","Biophys Chem. 2012 Jun;167:36-42. doi: 10.1016/j.bpc.2012.04.004. Epub 2012 May 5.","Toledo-Núñez C","Biophys Chem","2012","2012/05/29","","","10.1016/j.bpc.2012.04.004"
"8597577","A study of a series of recombinant fungal laccases and bilirubin oxidase that exhibit significant differences in redox potential, substrate specificity, and stability","Xu F, Shin W, Brown SH, Wahleithner JA, Sundaram UM, Solomon EI.","Biochim Biophys Acta. 1996 Feb 8;1292(2):303-11. doi: 10.1016/0167-4838(95)00210-3.","Xu F","Biochim Biophys Acta","1996","1996/02/08","","","10.1016/0167-4838(95)00210-3"
"23715853","Cleavage and synthesis function of high and low redox potential laccases towards 4-morpholinoaniline and aminated as well as chlorinated phenols","Hahn V, Mikolasch A, Schauer F.","Appl Microbiol Biotechnol. 2014 Feb;98(4):1609-20. doi: 10.1007/s00253-013-4984-9. Epub 2013 May 29.","Hahn V","Appl Microbiol Biotechnol","2014","2013/05/30","","","10.1007/s00253-013-4984-9"
"33807631","Prospection of Fungal Lignocellulolytic Enzymes Produced from Jatoba (Hymenaea courbaril) and Tamarind (Tamarindus indica) Seeds: Scaling for Bioreactor and Saccharification Profile of Sugarcane Bagasse","Contato AG, de Oliveira TB, Aranha GM, de Freitas EN, Vici AC, Nogueira KMV, de Lucas RC, Scarcella ASA, Buckeridge MS, Silva RN, Polizeli MLTM.","Microorganisms. 2021 Mar 5;9(3):533. doi: 10.3390/microorganisms9030533.","Contato AG","Microorganisms","2021","2021/04/03","PMC8000596","","10.3390/microorganisms9030533"
"22436888","Structural features of β-(1→4)-D-galactomannans of plant origin as a probe for β-(1→4)-mannanase polymeric substrate specificity","Klyosov AA, Dotsenko GS, Hinz SW, Sinitsyn AP.","Carbohydr Res. 2012 May 1;352:65-9. doi: 10.1016/j.carres.2012.02.030. Epub 2012 Mar 6.","Klyosov AA","Carbohydr Res","2012","2012/03/23","","","10.1016/j.carres.2012.02.030"
"9925554","Biophysical characterization of fungal phytases (myo-inositol hexakisphosphate phosphohydrolases): molecular size, glycosylation pattern, and engineering of proteolytic resistance","Wyss M, Pasamontes L, Friedlein A, Rémy R, Tessier M, Kronenberger A, Middendorf A, Lehmann M, Schnoebelen L, Röthlisberger U, Kusznir E, Wahl G, Müller F, Lahm HW, Vogel K, van Loon AP.","Appl Environ Microbiol. 1999 Feb;65(2):359-66. doi: 10.1128/AEM.65.2.359-366.1999.","Wyss M","Appl Environ Microbiol","1999","1999/01/30","PMC91033","","10.1128/AEM.65.2.359-366.1999"
"12817956","Spectroscopic characterization of the Leu513His variant of fungal laccase: effect of increased axial ligand interaction on the geometric and electronic structure of the type 1 Cu site","Palmer AE, Szilagyi RK, Cherry JR, Jones A, Xu F, Solomon EI.","Inorg Chem. 2003 Jun 30;42(13):4006-17. doi: 10.1021/ic026099n.","Palmer AE","Inorg Chem","2003","2003/06/24","","","10.1021/ic026099n"
"30383933","[CHARACTERISTICS OF FUNGAL STRAINS PRODUCING THERMOSTABLE XYLOGLUCANASES FROM THE RUSSIAN NATIONAL COLLECTION OF INDUSTRIAL MICROORGANISMS.]","Krestyanova IN, Sakhibgaraeva LF, Berezina OV, Rykov SV, Zavyalov AV, Zverlov VV, Yarotsky SV.","Mol Gen Mikrobiol Virusol. 2016;34(3):109-114.","Krestyanova IN","Mol Gen Mikrobiol Virusol","2016","2018/11/02","","",""
"18668239","Laccase-induced C-N coupling of substituted p-hydroquinones with p-aminobenzoic acid in comparison with known chemical routes","Mikolasch A, Matthies A, Lalk M, Schauer F.","Appl Microbiol Biotechnol. 2008 Sep;80(3):389-97. doi: 10.1007/s00253-008-1595-y. Epub 2008 Jul 31.","Mikolasch A","Appl Microbiol Biotechnol","2008","2008/08/01","","","10.1007/s00253-008-1595-y"
"36866191","Safety and efficacy of a feed additive consisting of endo-1,4-β-d-mannanase produced by Thermothelomyces thermophilusDSM 33149 (Natupulse® TS/TS L) for chickens and turkeys for fattening, minor poultry species for fattening and ornamental birds (BASF SE)","EFSA Panel on Additives and Products or Substances used in Animal Feed (FEEDAP); Bampidis V, Azimonti G, Bastos ML, Christensen H, Durjava M, Dusemund B, Kouba M, López-Alonso M, López Puente S, Marcon F, Mayo B, Pechová A, Petkova M, Ramos F, Sanz Y, Villa RE, Woutersen R, Brantom P, Herman L, Louro H, Anguita M, Brozzi R, Galobart J, Innocenti ML, Ortuño J, Pettenati E, Pizzo F, Revez J.","EFSA J. 2023 Feb 28;21(2):e07873. doi: 10.2903/j.efsa.2023.7873. eCollection 2023 Feb.","EFSA Panel on Additives and Products or Substances used in Animal Feed (FEEDAP)","EFSA J","2023","2023/03/03","PMC9972018","","10.2903/j.efsa.2023.7873"
"37164048","Production of recombinant lytic polysaccharide monooxygenases and evaluation effect of its addition into Aspergillus fumigatus var. niveus cocktail for sugarcane bagasse saccharification","Gonçalves AL, Cunha PM, da Silva Lima A, Dos Santos JC, Segato F.","Biochim Biophys Acta Proteins Proteom. 2023 May 8;1871(4):140919. doi: 10.1016/j.bbapap.2023.140919. Online ahead of print.","Gonçalves AL","Biochim Biophys Acta Proteins Proteom","2023","2023/05/10","","","10.1016/j.bbapap.2023.140919"
"17932916","Altering the laccase functionality by in vivo assembly of mutant libraries with different mutational spectra","Zumárraga M, Camarero S, Shleev S, Martínez-Arias A, Ballesteros A, Plou FJ, Alcalde M.","Proteins. 2008 Apr;71(1):250-60. doi: 10.1002/prot.21699.","Zumárraga M","Proteins","2008","2007/10/13","","","10.1002/prot.21699"
