PMID,Title,Authors,Citation,First Author,Journal/Book,Publication Year,Create Date,PMCID,NIHMS ID,DOI
"25025273","Myceliophthora thermophila syn. Sporotrichum thermophile: a thermophilic mould of biotechnological potential","Singh B.","Crit Rev Biotechnol. 2016;36(1):59-69. doi: 10.3109/07388551.2014.923985. Epub 2014 Jul 15.","Singh B","Crit Rev Biotechnol","2016","2014/07/16","","","10.3109/07388551.2014.923985"
"32640074","Growth kinetics of Myceliophthora thermophila M.7·7 in solid-state cultivation","Dos Santos Gomes AC, Casciatori FP, Gomes E, da Costa Carreira Nunes C, Moretti MMS, Thoméo JC.","J Appl Microbiol. 2021 Jan;130(1):90-99. doi: 10.1111/jam.14774. Epub 2020 Jul 29.","Dos Santos Gomes AC","J Appl Microbiol","2021","2020/07/09","","","10.1111/jam.14774"
"24995002","Genomic insights into the fungal lignocellulolytic system of Myceliophthora thermophila","Karnaouri A, Topakas E, Antonopoulou I, Christakopoulos P.","Front Microbiol. 2014 Jun 18;5:281. doi: 10.3389/fmicb.2014.00281. eCollection 2014.","Karnaouri A","Front Microbiol","2014","2014/07/05","PMC4061905","","10.3389/fmicb.2014.00281"
"35450635","Extending the diversity of Myceliophthora thermophila LPMOs: Two different xyloglucan cleavage profiles","Sun P, de Munnik M, van Berkel WJH, Kabel MA.","Carbohydr Polym. 2022 Jul 15;288:119373. doi: 10.1016/j.carbpol.2022.119373. Epub 2022 Mar 18.","Sun P","Carbohydr Polym","2022","2022/04/22","","","10.1016/j.carbpol.2022.119373"
"31534479","Myceliophthora thermophila Xyr1 is predominantly involved in xylan degradation and xylose catabolism","Dos Santos Gomes AC, Falkoski D, Battaglia E, Peng M, Nicolau de Almeida M, Coconi Linares N, Meijnen JP, Visser J, de Vries RP.","Biotechnol Biofuels. 2019 Sep 16;12:220. doi: 10.1186/s13068-019-1556-y. eCollection 2019.","Dos Santos Gomes AC","Biotechnol Biofuels","2019","2019/09/20","PMC6745793","","10.1186/s13068-019-1556-y"
"31802333","Improving cellulases production by Myceliophthora thermophila through disruption of protease genes","Li X, Liu Q, Sun W, He Q, Tian C.","Biotechnol Lett. 2020 Feb;42(2):219-229. doi: 10.1007/s10529-019-02777-0. Epub 2019 Dec 4.","Li X","Biotechnol Lett","2020","2019/12/06","","","10.1007/s10529-019-02777-0"
"35257374","Reconstruction and analysis of genome-scale metabolic model for thermophilic fungus Myceliophthora thermophila","Liu D, Xu Z, Li J, Liu Q, Yuan Q, Guo Y, Ma H, Tian C.","Biotechnol Bioeng. 2022 Jul;119(7):1926-1937. doi: 10.1002/bit.28080. Epub 2022 Mar 24.","Liu D","Biotechnol Bioeng","2022","2022/03/08","","","10.1002/bit.28080"
"34735642","Recombinant cellobiohydrolase of Myceliophthora thermophila: characterization and applicability in cellulose saccharification","Dadwal A, Sharma S, Satyanarayana T.","AMB Express. 2021 Nov 4;11(1):148. doi: 10.1186/s13568-021-01311-8.","Dadwal A","AMB Express","2021","2021/11/04","PMC8568750","","10.1186/s13568-021-01311-8"
"27807811","Myceliophthora thermophila M77 utilizes hydrolytic and oxidative mechanisms to deconstruct biomass","Dos Santos HB, Bezerra TMS, Pradella JGC, Delabona P, Lima D, Gomes E, Hartson SD, Rogers J, Couger B, Prade R.","AMB Express. 2016 Dec;6(1):103. doi: 10.1186/s13568-016-0276-y. Epub 2016 Nov 2.","Dos Santos HB","AMB Express","2016","2016/11/04","PMC5093097","","10.1186/s13568-016-0276-y"
"31078793","Direct production of commodity chemicals from lignocellulose using Myceliophthora thermophila","Li J, Lin L, Sun T, Xu J, Ji J, Liu Q, Tian C.","Metab Eng. 2020 Sep;61:416-426. doi: 10.1016/j.ymben.2019.05.007. Epub 2019 May 9.","Li J","Metab Eng","2020","2019/05/13","","","10.1016/j.ymben.2019.05.007"
"33995328","Transcriptional Profiling of Myceliophthora thermophila on Galactose and Metabolic Engineering for Improved Galactose Utilization","Wang H, Sun T, Zhao Z, Gu S, Liu Q, Wu T, Wang D, Tian C, Li J.","Front Microbiol. 2021 Apr 28;12:664011. doi: 10.3389/fmicb.2021.664011. eCollection 2021.","Wang H","Front Microbiol","2021","2021/05/17","PMC8113861","","10.3389/fmicb.2021.664011"
"34489043","Structural studies of Myceliophthora Thermophila Laccase in the presence of deep eutectic solvents","Chan JC, Zhang B, Martinez M, Kuruba B, Brozik J, Kang C, Zhang X.","Enzyme Microb Technol. 2021 Oct;150:109890. doi: 10.1016/j.enzmictec.2021.109890. Epub 2021 Aug 8.","Chan JC","Enzyme Microb Technol","2021","2021/09/07","","","10.1016/j.enzmictec.2021.109890"
"36165620","MtTRC-1, a Novel Transcription Factor, Regulates Cellulase Production via Directly Modulating the Genes Expression of the Mthac-1 and Mtcbh-1 in Myceliophthora thermophila","Li N, Liu Y, Liu D, Liu D, Zhang C, Lin L, Zhu Z, Li H, Dai Y, Wang X, Liu Q, Tian C.","Appl Environ Microbiol. 2022 Oct 11;88(19):e0126322. doi: 10.1128/aem.01263-22. Epub 2022 Sep 27.","Li N","Appl Environ Microbiol","2022","2022/09/27","PMC9552611","","10.1128/aem.01263-22"
"35608343","Development of an Efficient C-to-T Base-Editing System and Its Application to Cellulase Transcription Factor Precise Engineering in Thermophilic Fungus Myceliophthora thermophila","Zhang C, Li N, Rao L, Li J, Liu Q, Tian C.","Microbiol Spectr. 2022 Jun 29;10(3):e0232121. doi: 10.1128/spectrum.02321-21. Epub 2022 May 24.","Zhang C","Microbiol Spectr","2022","2022/05/24","PMC9241923","","10.1128/spectrum.02321-21"
"36478865","PFK2/FBPase-2 is a potential target for metabolic engineering in the filamentous fungus Myceliophthora thermophila","Hu D, Zhang Y, Liu D, Wang D, Tian C.","Front Microbiol. 2022 Nov 21;13:1056694. doi: 10.3389/fmicb.2022.1056694. eCollection 2022.","Hu D","Front Microbiol","2022","2022/12/08","PMC9721465","","10.3389/fmicb.2022.1056694"
"33413029","Structural aspects of β-glucosidase of Myceliophthora thermophila (MtBgl3c) by homology modelling and molecular docking","Dadwal A, Singh V, Sharma S, Satyanarayana T.","J Biomol Struct Dyn. 2022 Jul;40(11):5211-5228. doi: 10.1080/07391102.2020.1869095. Epub 2021 Jan 8.","Dadwal A","J Biomol Struct Dyn","2022","2021/01/08","","","10.1080/07391102.2020.1869095"
"26013561","Development of genetic tools for Myceliophthora thermophila","Xu J, Li J, Lin L, Liu Q, Sun W, Huang B, Tian C.","BMC Biotechnol. 2015 May 27;15:35. doi: 10.1186/s12896-015-0165-5.","Xu J","BMC Biotechnol","2015","2015/05/28","PMC4446196","","10.1186/s12896-015-0165-5"
"19095833","Left ventricular assist device outflow cannula obstruction by the rare environmental fungus Myceliophthora thermophila","Weitzel N, Puskas F, Cleveland J, Levi ME, Seres T.","Anesth Analg. 2009 Jan;108(1):73-5. doi: 10.1213/ane.0b013e318187b8fc.","Weitzel N","Anesth Analg","2009","2008/12/20","","","10.1213/ane.0b013e318187b8fc"
"36799667","Biochemical characteristics of Myceliophthora thermophila recombinant β-glucosidase (MtBgl3c) applicable in cellulose bioconversion","Dadwal A, Sharma S, Satyanarayana T.","Prep Biochem Biotechnol. 2023 Feb 17:1-12. doi: 10.1080/10826068.2023.2177869. Online ahead of print.","Dadwal A","Prep Biochem Biotechnol","2023","2023/02/17","","","10.1080/10826068.2023.2177869"
"36691040","The Weimberg pathway: an alternative for Myceliophthora thermophila to utilize D-xylose","Liu D, Zhang Y, Li J, Sun W, Yao Y, Tian C.","Biotechnol Biofuels Bioprod. 2023 Jan 23;16(1):13. doi: 10.1186/s13068-023-02266-7.","Liu D","Biotechnol Biofuels Bioprod","2023","2023/01/23","PMC9869559","","10.1186/s13068-023-02266-7"
"21075873","Extracellular aldonolactonase from Myceliophthora thermophila","Beeson WT 4th, Iavarone AT, Hausmann CD, Cate JH, Marletta MA.","Appl Environ Microbiol. 2011 Jan;77(2):650-6. doi: 10.1128/AEM.01922-10. Epub 2010 Nov 12.","Beeson WT 4th","Appl Environ Microbiol","2011","2010/11/16","PMC3020561","","10.1128/AEM.01922-10"
"36238990","Structural and thermostability insights into cellobiohydrolase of a thermophilic mould Myceliophthora thermophila: in-silico studies","Dadwal A, Singh V, Sharma S, Sahoo AK, Satyanarayana T.","J Biomol Struct Dyn. 2022 Oct 13:1-10. doi: 10.1080/07391102.2022.2133012. Online ahead of print.","Dadwal A","J Biomol Struct Dyn","2022","2022/10/14","","","10.1080/07391102.2022.2133012"
"36174898","Deciphering the efficient cellulose degradation by the thermophilic fungus Myceliophthora thermophila focused on the synergistic action of glycoside hydrolases and lytic polysaccharide monooxygenases","Qin X, Zou J, Yang K, Li J, Wang X, Tu T, Wang Y, Yao B, Huang H, Luo H.","Bioresour Technol. 2022 Sep 26;364:128027. doi: 10.1016/j.biortech.2022.128027. Online ahead of print.","Qin X","Bioresour Technol","2022","2022/09/29","","","10.1016/j.biortech.2022.128027"
"33765291","Biochemical characterization and enhanced production of endoxylanase from thermophilic mould Myceliophthora thermophila","Dahiya S, Kumar A, Malik V, Kumar V, Singh B.","Bioprocess Biosyst Eng. 2021 Jul;44(7):1539-1555. doi: 10.1007/s00449-021-02539-1. Epub 2021 Mar 25.","Dahiya S","Bioprocess Biosyst Eng","2021","2021/03/25","","","10.1007/s00449-021-02539-1"
"30534201","Metabolic engineering of the thermophilic filamentous fungus Myceliophthora thermophila to produce fumaric acid","Gu S, Li J, Chen B, Sun T, Liu Q, Xiao D, Tian C.","Biotechnol Biofuels. 2018 Dec 3;11:323. doi: 10.1186/s13068-018-1319-1. eCollection 2018.","Gu S","Biotechnol Biofuels","2018","2018/12/12","PMC6278111","","10.1186/s13068-018-1319-1"
"27629413","Discovery of a Xylooligosaccharide Oxidase from Myceliophthora thermophila C1","Ferrari AR, Rozeboom HJ, Dobruchowska JM, van Leeuwen SS, Vugts AS, Koetsier MJ, Visser J, Fraaije MW.","J Biol Chem. 2016 Nov 4;291(45):23709-23718. doi: 10.1074/jbc.M116.741173. Epub 2016 Sep 14.","Ferrari AR","J Biol Chem","2016","2016/09/16","PMC5095424","","10.1074/jbc.M116.741173"
"29843921","Transcriptional analysis of Myceliophthora thermophila on soluble starch and role of regulator AmyR on polysaccharide degradation","Xu G, Li J, Liu Q, Sun W, Jiang M, Tian C.","Bioresour Technol. 2018 Oct;265:558-562. doi: 10.1016/j.biortech.2018.05.086. Epub 2018 May 24.","Xu G","Bioresour Technol","2018","2018/05/31","","","10.1016/j.biortech.2018.05.086"
"31114738","Enhanced endoxylanase production by Myceliophthora thermophila with applicability in saccharification of agricultural substrates","Dahiya S, Singh B.","3 Biotech. 2019 Jun;9(6):214. doi: 10.1007/s13205-019-1750-4. Epub 2019 May 18.","Dahiya S","3 Biotech","2019","2019/05/23","PMC6525679","","10.1007/s13205-019-1750-4"
"31381927","A lytic polysaccharide monooxygenase from Myceliophthora thermophila and its synergism with cellobiohydrolases in cellulose hydrolysis","Zhou H, Li T, Yu Z, Ju J, Zhang H, Tan H, Li K, Yin H.","Int J Biol Macromol. 2019 Oct 15;139:570-576. doi: 10.1016/j.ijbiomac.2019.08.004. Epub 2019 Aug 2.","Zhou H","Int J Biol Macromol","2019","2019/08/06","","","10.1016/j.ijbiomac.2019.08.004"
"29303991","Characterization of Two VAO-Type Flavoprotein Oxidases from Myceliophthora thermophila","Ferrari AR, Rozeboom HJ, Vugts ASC, Koetsier MJ, Floor R, Fraaije MW.","Molecules. 2018 Jan 5;23(1):111. doi: 10.3390/molecules23010111.","Ferrari AR","Molecules","2018","2018/01/06","PMC6017366","","10.3390/molecules23010111"
"32021654","Metabolic engineering of the cellulolytic thermophilic fungus Myceliophthora thermophila to produce ethanol from cellobiose","Li J, Zhang Y, Li J, Sun T, Tian C.","Biotechnol Biofuels. 2020 Feb 1;13:23. doi: 10.1186/s13068-020-1661-y. eCollection 2020.","Li J","Biotechnol Biofuels","2020","2020/02/06","PMC6995234","","10.1186/s13068-020-1661-y"
"32984289","Evaluation of the Enzymatic Arsenal Secreted by Myceliophthora thermophila During Growth on Sugarcane Bagasse With a Focus on LPMOs","Grieco MAB, Haon M, Grisel S, de Oliveira-Carvalho AL, Magalhães AV, Zingali RB, Pereira N Jr, Berrin JG.","Front Bioeng Biotechnol. 2020 Aug 25;8:1028. doi: 10.3389/fbioe.2020.01028. eCollection 2020.","Grieco MAB","Front Bioeng Biotechnol","2020","2020/09/28","PMC7477043","","10.3389/fbioe.2020.01028"
"30974557","Polymerization of Various Lignins via Immobilized Myceliophthora thermophila Laccase (MtL)","Huber D, Pellis A, Daxbacher A, Nyanhongo GS, Guebitz GM.","Polymers (Basel). 2016 Aug 3;8(8):280. doi: 10.3390/polym8080280.","Huber D","Polymers (Basel)","2016","2019/04/13","PMC6431913","","10.3390/polym8080280"
"27128897","Bioconversion of Biomass-Derived Phenols Catalyzed by Myceliophthora thermophila Laccase","Zerva A, Manos N, Vouyiouka S, Christakopoulos P, Topakas E.","Molecules. 2016 Apr 27;21(5):550. doi: 10.3390/molecules21050550.","Zerva A","Molecules","2016","2016/04/30","PMC6273956","","10.3390/molecules21050550"
"29359934","Chitinase Chi1 from Myceliophthora thermophila C1, a Thermostable Enzyme for Chitin and Chitosan Depolymerization","Krolicka M, Hinz SWA, Koetsier MJ, Joosten R, Eggink G, van den Broek LAM, Boeriu CG.","J Agric Food Chem. 2018 Feb 21;66(7):1658-1669. doi: 10.1021/acs.jafc.7b04032. Epub 2018 Feb 7.","Krolicka M","J Agric Food Chem","2018","2018/01/24","PMC5847117","","10.1021/acs.jafc.7b04032"
"29943052","β-N-Acetylglucosaminidase MthNAG from Myceliophthora thermophila C1, a thermostable enzyme for production of N-acetylglucosamine from chitin","Krolicka M, Hinz SWA, Koetsier MJ, Eggink G, van den Broek LAM, Boeriu CG.","Appl Microbiol Biotechnol. 2018 Sep;102(17):7441-7454. doi: 10.1007/s00253-018-9166-3. Epub 2018 Jun 25.","Krolicka M","Appl Microbiol Biotechnol","2018","2018/06/27","PMC6097783","","10.1007/s00253-018-9166-3"
"29527447","A new regulator of cellulase and xylanase in the thermophilic fungus Myceliophthora thermophila strain ATCC 42464","Wang J, Gong Y, Zhao S, Liu G.","3 Biotech. 2018 Mar;8(3):160. doi: 10.1007/s13205-017-1069-y. Epub 2018 Mar 5.","Wang J","3 Biotech","2018","2018/03/13","PMC5835483","","10.1007/s13205-017-1069-y"
"31911243","Additional sequence and structural characterization of an endo-processive GH74 xyloglucanase from Myceliophthora thermophila and the revision of the EC 3.2.1.155 entry","Gusakov AV.","Biochim Biophys Acta Gen Subj. 2020 Mar;1864(3):129511. doi: 10.1016/j.bbagen.2020.129511. Epub 2020 Jan 3.","Gusakov AV","Biochim Biophys Acta Gen Subj","2020","2020/01/09","","","10.1016/j.bbagen.2020.129511"
"29222836","Biochemical and structural insights into a thermostable cellobiohydrolase from Myceliophthora thermophila","Kadowaki MAS, Higasi P, de Godoy MO, Prade RA, Polikarpov I.","FEBS J. 2018 Feb;285(3):559-579. doi: 10.1111/febs.14356. Epub 2018 Jan 1.","Kadowaki MAS","FEBS J","2018","2017/12/10","","","10.1111/febs.14356"
"32253539","Construction of a new thermophilic fungus Myceliophthora thermophila platform for enzyme production using a versatile 2A peptide strategy combined with efficient CRISPR-Cas9 system","Li F, Liu Q, Li X, Zhang C, Li J, Sun W, Liu D, Xiao D, Tian C.","Biotechnol Lett. 2020 Jul;42(7):1181-1191. doi: 10.1007/s10529-020-02882-5. Epub 2020 Apr 6.","Li F","Biotechnol Lett","2020","2020/04/08","","","10.1007/s10529-020-02882-5"
"31786675","High-level expression of highly active and thermostable trehalase from Myceliophthora thermophila in Aspergillus niger by using the CRISPR/Cas9 tool and its application in ethanol fermentation","Dong L, Lin X, Yu D, Huang L, Wang B, Pan L.","J Ind Microbiol Biotechnol. 2020 Jan;47(1):133-144. doi: 10.1007/s10295-019-02252-9. Epub 2019 Nov 30.","Dong L","J Ind Microbiol Biotechnol","2020","2019/12/02","","","10.1007/s10295-019-02252-9"
"27193267","A thermostable GH26 endo-β-mannanase from Myceliophthora thermophila capable of enhancing lignocellulose degradation","Katsimpouras C, Dimarogona M, Petropoulos P, Christakopoulos P, Topakas E.","Appl Microbiol Biotechnol. 2016 Oct;100(19):8385-97. doi: 10.1007/s00253-016-7609-2. Epub 2016 May 19.","Katsimpouras C","Appl Microbiol Biotechnol","2016","2016/05/20","","","10.1007/s00253-016-7609-2"
"24881579","Transcriptome and exoproteome analysis of utilization of plant-derived biomass by Myceliophthora thermophila","Kolbusz MA, Di Falco M, Ishmael N, Marqueteau S, Moisan MC, Baptista CDS, Powlowski J, Tsang A.","Fungal Genet Biol. 2014 Nov;72:10-20. doi: 10.1016/j.fgb.2014.05.006. Epub 2014 May 29.","Kolbusz MA","Fungal Genet Biol","2014","2014/06/03","","","10.1016/j.fgb.2014.05.006"
"37013645","The putative methyltransferase LaeA regulates mycelium growth and cellulase production in Myceliophthora thermophila","Zhao Z, Gu S, Liu D, Liu D, Chen B, Li J, Tian C.","Biotechnol Biofuels Bioprod. 2023 Apr 3;16(1):58. doi: 10.1186/s13068-023-02313-3.","Zhao Z","Biotechnol Biofuels Bioprod","2023","2023/04/04","PMC10071736","","10.1186/s13068-023-02313-3"
"37066045","AA16 Oxidoreductases Boost Cellulose-Active AA9 Lytic Polysaccharide Monooxygenases from Myceliophthora thermophila","Sun P, Huang Z, Banerjee S, Kadowaki MAS, Veersma RJ, Magri S, Hilgers R, Muderspach SJ, Laurent CVFP, Ludwig R, Cannella D, Lo Leggio L, van Berkel WJH, Kabel MA.","ACS Catal. 2023 Mar 21;13(7):4454-4467. doi: 10.1021/acscatal.3c00874. eCollection 2023 Apr 7.","Sun P","ACS Catal","2023","2023/04/17","PMC10088020","","10.1021/acscatal.3c00874"
"29687143","Evolution of the feruloyl esterase MtFae1a from Myceliophthora thermophila towards improved catalysts for antioxidants synthesis","Varriale S, Cerullo G, Antonopoulou I, Christakopoulos P, Rova U, Tron T, Fauré R, Jütten P, Piechot A, Brás JLA, Fontes CMGA, Faraco V.","Appl Microbiol Biotechnol. 2018 Jun;102(12):5185-5196. doi: 10.1007/s00253-018-8995-4. Epub 2018 Apr 23.","Varriale S","Appl Microbiol Biotechnol","2018","2018/04/25","","","10.1007/s00253-018-8995-4"
"31890021","Upgrading of efficient and scalable CRISPR-Cas-mediated technology for genetic engineering in thermophilic fungus Myceliophthora thermophila","Liu Q, Zhang Y, Li F, Li J, Sun W, Tian C.","Biotechnol Biofuels. 2019 Dec 23;12:293. doi: 10.1186/s13068-019-1637-y. eCollection 2019.","Liu Q","Biotechnol Biofuels","2019","2020/01/01","PMC6927189","","10.1186/s13068-019-1637-y"
"37178549","Construction and characterization of a Myceliophthora thermophila lytic polysaccharide monooxygenase mutant S174C/A93C with improved thermostability","Guo X, Jiang L, An Y, Lu F, Liu F, Wang B.","Enzyme Microb Technol. 2023 May 10;168:110255. doi: 10.1016/j.enzmictec.2023.110255. Online ahead of print.","Guo X","Enzyme Microb Technol","2023","2023/05/13","","","10.1016/j.enzmictec.2023.110255"
"25541341","Glucoamylases from Penicillium verruculosum and Myceliophthora thermophila: analysis of differences in activity against polymeric substrates based on 3D model structures of the intact enzymes","Volkov PV, Rozhkova AM, Gusakov AV, Zorov IN, Sinitsyn AP.","Biochimie. 2015 Mar;110:45-51. doi: 10.1016/j.biochi.2014.12.010. Epub 2014 Dec 23.","Volkov PV","Biochimie","2015","2014/12/27","","","10.1016/j.biochi.2014.12.010"
"26173497","Enhancing xylanase production in the thermophilic fungus Myceliophthora thermophila by homologous overexpression of Mtxyr1","Wang J, Wu Y, Gong Y, Yu S, Liu G.","J Ind Microbiol Biotechnol. 2015 Sep;42(9):1233-41. doi: 10.1007/s10295-015-1628-3. Epub 2015 Jul 15.","Wang J","J Ind Microbiol Biotechnol","2015","2015/07/16","","","10.1007/s10295-015-1628-3"
"31754437","Dissecting cellobiose metabolic pathway and its application in biorefinery through consolidated bioprocessing in Myceliophthora thermophila","Li J, Gu S, Zhao Z, Chen B, Liu Q, Sun T, Sun W, Tian C.","Fungal Biol Biotechnol. 2019 Nov 13;6:21. doi: 10.1186/s40694-019-0083-8. eCollection 2019.","Li J","Fungal Biol Biotechnol","2019","2019/11/23","PMC6852783","","10.1186/s40694-019-0083-8"
"25919617","Chemical modification and immobilisation of laccase from Trametes hirsuta and from Myceliophthora thermophila","Forde J, Tully E, Vakurov A, Gibson TD, Millner P, Ó'Fágáin C.","Enzyme Microb Technol. 2010 May 5;46(6):430-7. doi: 10.1016/j.enzmictec.2010.01.004. Epub 2010 Jan 25.","Forde J","Enzyme Microb Technol","2010","2015/04/29","","","10.1016/j.enzmictec.2010.01.004"
"25037346","Characterization of an acetyl esterase from Myceliophthora thermophila C1 able to deacetylate xanthan","Kool MM, Schols HA, Wagenknecht M, Hinz SW, Moerschbacher BM, Gruppen H.","Carbohydr Polym. 2014 Oct 13;111:222-9. doi: 10.1016/j.carbpol.2014.04.064. Epub 2014 Apr 26.","Kool MM","Carbohydr Polym","2014","2014/07/20","","","10.1016/j.carbpol.2014.04.064"
"28477154","Thermostable multifunctional GH74 xyloglucanase from Myceliophthora thermophila: high-level expression in Pichia pastoris and characterization of the recombinant protein","Berezina OV, Herlet J, Rykov SV, Kornberger P, Zavyalov A, Kozlov D, Sakhibgaraeva L, Krestyanova I, Schwarz WH, Zverlov VV, Liebl W, Yarotsky SV.","Appl Microbiol Biotechnol. 2017 Jul;101(14):5653-5666. doi: 10.1007/s00253-017-8297-2. Epub 2017 May 5.","Berezina OV","Appl Microbiol Biotechnol","2017","2017/05/07","","","10.1007/s00253-017-8297-2"
"34556173","Coordination of consolidated bioprocessing technology and carbon dioxide fixation to produce malic acid directly from plant biomass in Myceliophthora thermophila","Li J, Chen B, Gu S, Zhao Z, Liu Q, Sun T, Zhang Y, Wu T, Liu D, Sun W, Tian C.","Biotechnol Biofuels. 2021 Sep 23;14(1):186. doi: 10.1186/s13068-021-02042-5.","Li J","Biotechnol Biofuels","2021","2021/09/24","PMC8461902","","10.1186/s13068-021-02042-5"
"30125294","Functional characterization of a lytic polysaccharide monooxygenase from the thermophilic fungus Myceliophthora thermophila","Kadowaki MAS, Várnai A, Jameson JK, T Leite AE, Costa-Filho AJ, Kumagai PS, Prade RA, Polikarpov I, Eijsink VGH.","PLoS One. 2018 Aug 20;13(8):e0202148. doi: 10.1371/journal.pone.0202148. eCollection 2018.","Kadowaki MAS","PLoS One","2018","2018/08/21","PMC6101365","","10.1371/journal.pone.0202148"
"25824435","Enhancing Cellulase Production in Thermophilic Fungus Myceliophthora thermophila ATCC42464 by RNA Interference of cre1 Gene Expression","Yang F, Gong Y, Liu G, Zhao S, Wang J.","J Microbiol Biotechnol. 2015 Jul;25(7):1101-7. doi: 10.4014/jmb.1501.01049.","Yang F","J Microbiol Biotechnol","2015","2015/04/01","","","10.4014/jmb.1501.01049"
"21619496","Invasive Myceliophthora thermophila infection mimicking invasive aspergillosis in a neutropenic patient: a new cause of cross-reactivity with the Aspergillus galactomannan serum antigen assay","Morio F, Fraissinet F, Gastinne T, Le Pape P, Delaunay J, Sigler L, Gibas CF, Miegeville M.","Med Mycol. 2011 Nov;49(8):883-6. doi: 10.3109/13693786.2011.584218. Epub 2011 May 30.","Morio F","Med Mycol","2011","2011/05/31","","","10.3109/13693786.2011.584218"
"23240568","Cloning, purification, and characterization of galactomannan-degrading enzymes from Myceliophthora thermophila","Dotsenko GS, Semenova MV, Sinitsyna OA, Hinz SW, Wery J, Zorov IN, Kondratieva EG, Sinitsyn AP.","Biochemistry (Mosc). 2012 Nov;77(11):1303-11. doi: 10.1134/S0006297912110090.","Dotsenko GS","Biochemistry (Mosc)","2012","2012/12/18","","","10.1134/S0006297912110090"
"27588039","Lytic polysaccharide monooxygenases from Myceliophthora thermophila C1 differ in substrate preference and reducing agent specificity","Frommhagen M, Koetsier MJ, Westphal AH, Visser J, Hinz SW, Vincken JP, van Berkel WJ, Kabel MA, Gruppen H.","Biotechnol Biofuels. 2016 Aug 31;9(1):186. doi: 10.1186/s13068-016-0594-y. eCollection 2016.","Frommhagen M","Biotechnol Biofuels","2016","2016/09/03","PMC5007705","","10.1186/s13068-016-0594-y"
"28278111","Box-Behnken analysis and storage of spray-dried collagenolytic proteases from Myceliophthora thermophila submerged bioprocess","Hamin Neto YAA, Coitinho LB, de Freitas LAP, Cabral H.","Prep Biochem Biotechnol. 2017 May 28;47(5):473-480. doi: 10.1080/10826068.2017.1292289. Epub 2017 Feb 10.","Hamin Neto YAA","Prep Biochem Biotechnol","2017","2017/03/10","","","10.1080/10826068.2017.1292289"
"32149262","Lignin-Based Pesticide Delivery System","Weiss R, Ghitti E, Sumetzberger-Hasinger M, Guebitz GM, Nyanhongo GS.","ACS Omega. 2020 Feb 19;5(8):4322-4329. doi: 10.1021/acsomega.9b04275. eCollection 2020 Mar 3.","Weiss R","ACS Omega","2020","2020/03/10","PMC7057692","","10.1021/acsomega.9b04275"
"31407106","Glycosylation influences activity, stability and immobilization of the feruloyl esterase 1a from Myceliophthora thermophila","Bonzom C, Hüttner S, Mirgorodskaya E, Chong SL, Uthoff S, Steinbüchel A, Verhaert RMD, Olsson L.","AMB Express. 2019 Aug 12;9(1):126. doi: 10.1186/s13568-019-0852-z.","Bonzom C","AMB Express","2019","2019/08/14","PMC6691016","","10.1186/s13568-019-0852-z"
"36735022","Isolation of the Anti-Inflammatory Agent Myceliostatin from a Methionine-Enriched Culture of Myceliophthora thermophila ATCC 42464","Wu Y, Shen J, Wang L, Lin Y, Kojima S, Okada S, Umezawa K.","J Nat Prod. 2023 Feb 24;86(2):239-245. doi: 10.1021/acs.jnatprod.2c00811. Epub 2023 Feb 3.","Wu Y","J Nat Prod","2023","2023/02/03","","","10.1021/acs.jnatprod.2c00811"
"23683701","Two novel GH11 endo-xylanases from Myceliophthora thermophila C1 act differently toward soluble and insoluble xylans","van Gool MP, van Muiswinkel GC, Hinz SW, Schols HA, Sinitsyn AP, Gruppen H.","Enzyme Microb Technol. 2013 Jun 10;53(1):25-32. doi: 10.1016/j.enzmictec.2013.03.019. Epub 2013 Apr 2.","van Gool MP","Enzyme Microb Technol","2013","2013/05/21","","","10.1016/j.enzmictec.2013.03.019"
"29491860","Characterization of Two Endo-β-1, 4-Xylanases from Myceliophthora thermophila and Their Saccharification Efficiencies, Synergistic with Commercial Cellulase","Basit A, Liu J, Miao T, Zheng F, Rahim K, Lou H, Jiang W.","Front Microbiol. 2018 Feb 14;9:233. doi: 10.3389/fmicb.2018.00233. eCollection 2018.","Basit A","Front Microbiol","2018","2018/03/02","PMC5817056","","10.3389/fmicb.2018.00233"
